"1","0.000000","1698368211.650391000","10.45.0.3","192.168.238.198","GTP <TCP>","118","34011 → 34567 [SYN] Seq=0 Win=65280 Len=0 MSS=1360 SACK_PERM TSval=1641639155 TSecr=0 WS=128"
"2","0.000384","1698368211.650775000","192.168.238.198","10.45.0.3","GTP <TCP>","118","34567 → 34011 [SYN, ACK] Seq=0 Ack=1 Win=65160 Len=0 MSS=1460 SACK_PERM TSval=1706027685 TSecr=1641639155 WS=128"
"3","0.003702","1698368211.654093000","10.45.0.3","192.168.238.198","GTP <TCP>","110","34011 → 34567 [ACK] Seq=1 Ack=1 Win=65280 Len=0 TSval=1641639157 TSecr=1706027685"
"4","0.004490","1698368211.654881000","10.45.0.3","192.168.238.198","GTP <TCP>","110","34011 → 34567 [FIN, ACK] Seq=1 Ack=1 Win=65280 Len=0 TSval=1641639157 TSecr=1706027685"
"5","0.004808","1698368211.655199000","192.168.238.198","10.45.0.3","GTP <TCP>","110","34567 → 34011 [FIN, ACK] Seq=1 Ack=2 Win=65280 Len=0 TSval=1706027690 TSecr=1641639157"
"6","0.005231","1698368211.655622000","10.45.0.3","192.168.238.198","GTP <TCP>","110","34011 → 34567 [ACK] Seq=2 Ack=2 Win=65280 Len=0 TSval=1641639160 TSecr=1706027690"
"7","0.008783","1698368211.659174000","10.45.0.3","192.168.238.198","GTP <TCP>","118","54393 → 34567 [SYN] Seq=0 Win=65280 Len=0 MSS=1360 SACK_PERM TSval=1641639163 TSecr=0 WS=128"
"8","0.008986","1698368211.659377000","192.168.238.198","10.45.0.3","GTP <TCP>","118","34567 → 54393 [SYN, ACK] Seq=0 Ack=1 Win=65160 Len=0 MSS=1460 SACK_PERM TSval=1706027694 TSecr=1641639163 WS=128"
"9","0.010321","1698368211.660712000","10.45.0.3","192.168.238.198","GTP <TCP>","110","54393 → 34567 [ACK] Seq=1 Ack=1 Win=65280 Len=0 TSval=1641639164 TSecr=1706027694"
"10","0.010379","1698368211.660770000","10.45.0.3","192.168.238.198","GTP <TCP>","110","54393 → 34567 [FIN, ACK] Seq=1 Ack=1 Win=65280 Len=0 TSval=1641639165 TSecr=1706027694"
"11","0.011104","1698368211.661495000","192.168.238.198","10.45.0.3","GTP <TCP>","110","34567 → 54393 [FIN, ACK] Seq=1 Ack=2 Win=65280 Len=0 TSval=1706027696 TSecr=1641639165"
"12","0.011657","1698368211.662048000","10.45.0.3","192.168.238.198","GTP <TCP>","110","54393 → 34567 [ACK] Seq=2 Ack=2 Win=65280 Len=0 TSval=1641639166 TSecr=1706027696"
"13","0.037756","1698368211.688147000","10.45.0.3","192.168.238.198","GTP <TCP>","118","45987 → 34567 [SYN] Seq=0 Win=65280 Len=0 MSS=1360 SACK_PERM TSval=1641639192 TSecr=0 WS=128"
"14","0.038045","1698368211.688436000","192.168.238.198","10.45.0.3","GTP <TCP>","118","34567 → 45987 [SYN, ACK] Seq=0 Ack=1 Win=65160 Len=0 MSS=1460 SACK_PERM TSval=1706027723 TSecr=1641639192 WS=128"
"15","0.038750","1698368211.689141000","10.45.0.3","192.168.238.198","GTP <TCP>","110","45987 → 34567 [ACK] Seq=1 Ack=1 Win=65280 Len=0 TSval=1641639194 TSecr=1706027723"
"16","0.039657","1698368211.690048000","10.45.0.3","192.168.238.198","GTP <TCP>","130","45987 → 34567 [PSH, ACK] Seq=1 Ack=1 Win=65280 Len=20 TSval=1641639194 TSecr=1706027723"
"17","0.040189","1698368211.690580000","10.45.0.3","192.168.238.198","GTP <TCP>","386","45987 → 34567 [PSH, ACK] Seq=21 Ack=1 Win=65280 Len=276 TSval=1641639194 TSecr=1706027723"
"18","0.040461","1698368211.690852000","192.168.238.198","10.45.0.3","GTP <TCP>","110","34567 → 45987 [ACK] Seq=1 Ack=21 Win=65152 Len=0 TSval=1706027725 TSecr=1641639194"
"19","0.040550","1698368211.690941000","192.168.238.198","10.45.0.3","GTP <TCP>","110","34567 → 45987 [ACK] Seq=1 Ack=297 Win=64896 Len=0 TSval=1706027725 TSecr=1641639194"
"20","0.040637","1698368211.691028000","192.168.238.198","10.45.0.3","GTP <TCP>","145","34567 → 45987 [PSH, ACK] Seq=1 Ack=297 Win=64896 Len=35 TSval=1706027725 TSecr=1641639194"
"21","0.041069","1698368211.691460000","10.45.0.3","192.168.238.198","GTP <TCP>","110","45987 → 34567 [ACK] Seq=297 Ack=36 Win=65280 Len=0 TSval=1641639196 TSecr=1706027725"
"22","0.041338","1698368211.691729000","10.45.0.3","192.168.238.198","GTP <TCP>","130","45987 → 34567 [PSH, ACK] Seq=297 Ack=36 Win=65280 Len=20 TSval=1641639196 TSecr=1706027725"
"23","0.041470","1698368211.691861000","10.45.0.3","192.168.238.198","GTP <TCP>","461","45987 → 34567 [PSH, ACK] Seq=317 Ack=36 Win=65280 Len=351 TSval=1641639196 TSecr=1706027725"
"24","0.041668","1698368211.692059000","192.168.238.198","10.45.0.3","GTP <TCP>","110","34567 → 45987 [ACK] Seq=36 Ack=668 Win=64640 Len=0 TSval=1706027727 TSecr=1641639196"
"25","0.041763","1698368211.692154000","192.168.238.198","10.45.0.3","GTP <TCP>","145","34567 → 45987 [PSH, ACK] Seq=36 Ack=668 Win=64640 Len=35 TSval=1706027727 TSecr=1641639196"
"26","0.042807","1698368211.693198000","10.45.0.3","192.168.238.198","GTP <TCP>","110","45987 → 34567 [FIN, ACK] Seq=668 Ack=71 Win=65280 Len=0 TSval=1641639198 TSecr=1706027727"
"27","0.043155","1698368211.693546000","192.168.238.198","10.45.0.3","GTP <TCP>","110","34567 → 45987 [FIN, ACK] Seq=71 Ack=669 Win=64640 Len=0 TSval=1706027728 TSecr=1641639198"
"28","0.043661","1698368211.694052000","10.45.0.3","192.168.238.198","GTP <TCP>","110","45987 → 34567 [ACK] Seq=669 Ack=72 Win=65280 Len=0 TSval=1641639198 TSecr=1706027728"
"29","0.044126","1698368211.694517000","10.45.0.3","192.168.238.198","GTP <TCP>","118","45861 → 34567 [SYN] Seq=0 Win=65280 Len=0 MSS=1360 SACK_PERM TSval=1641639199 TSecr=0 WS=128"
"30","0.044276","1698368211.694667000","192.168.238.198","10.45.0.3","GTP <TCP>","118","34567 → 45861 [SYN, ACK] Seq=0 Ack=1 Win=65160 Len=0 MSS=1460 SACK_PERM TSval=1706027729 TSecr=1641639199 WS=128"
"31","0.044684","1698368211.695075000","10.45.0.3","192.168.238.198","GTP <TCP>","110","45861 → 34567 [ACK] Seq=1 Ack=1 Win=65280 Len=0 TSval=1641639200 TSecr=1706027729"
"32","0.045655","1698368211.696046000","10.45.0.3","192.168.238.198","GTP <TCP>","130","45861 → 34567 [PSH, ACK] Seq=1 Ack=1 Win=65280 Len=20 TSval=1641639200 TSecr=1706027729"
"33","0.045768","1698368211.696159000","10.45.0.3","192.168.238.198","GTP <TCP>","386","45861 → 34567 [PSH, ACK] Seq=21 Ack=1 Win=65280 Len=276 TSval=1641639200 TSecr=1706027729"
"34","0.045769","1698368211.696160000","192.168.238.198","10.45.0.3","GTP <TCP>","110","34567 → 45861 [ACK] Seq=1 Ack=21 Win=65152 Len=0 TSval=1706027731 TSecr=1641639200"
"35","0.045898","1698368211.696289000","192.168.238.198","10.45.0.3","GTP <TCP>","110","34567 → 45861 [ACK] Seq=1 Ack=297 Win=64896 Len=0 TSval=1706027731 TSecr=1641639200"
"36","0.045969","1698368211.696360000","192.168.238.198","10.45.0.3","GTP <TCP>","145","34567 → 45861 [PSH, ACK] Seq=1 Ack=297 Win=64896 Len=35 TSval=1706027731 TSecr=1641639200"
"37","0.046453","1698368211.696844000","10.45.0.3","192.168.238.198","GTP <TCP>","110","45861 → 34567 [ACK] Seq=297 Ack=36 Win=65280 Len=0 TSval=1641639201 TSecr=1706027731"
"38","0.046928","1698368211.697319000","10.45.0.3","192.168.238.198","GTP <TCP>","130","45861 → 34567 [PSH, ACK] Seq=297 Ack=36 Win=65280 Len=20 TSval=1641639202 TSecr=1706027731"
"39","0.047122","1698368211.697513000","10.45.0.3","192.168.238.198","GTP <TCP>","461","45861 → 34567 [PSH, ACK] Seq=317 Ack=36 Win=65280 Len=351 TSval=1641639202 TSecr=1706027731"
"40","0.047371","1698368211.697762000","192.168.238.198","10.45.0.3","GTP <TCP>","110","34567 → 45861 [ACK] Seq=36 Ack=668 Win=64640 Len=0 TSval=1706027732 TSecr=1641639202"
"41","0.047415","1698368211.697806000","192.168.238.198","10.45.0.3","GTP <TCP>","145","34567 → 45861 [PSH, ACK] Seq=36 Ack=668 Win=64640 Len=35 TSval=1706027732 TSecr=1641639202"
"42","0.048374","1698368211.698765000","10.45.0.3","192.168.238.198","GTP <TCP>","110","45861 → 34567 [FIN, ACK] Seq=668 Ack=71 Win=65280 Len=0 TSval=1641639203 TSecr=1706027732"
"43","0.048629","1698368211.699020000","192.168.238.198","10.45.0.3","GTP <TCP>","110","34567 → 45861 [FIN, ACK] Seq=71 Ack=669 Win=64640 Len=0 TSval=1706027734 TSecr=1641639203"
"44","0.049527","1698368211.699918000","10.45.0.3","192.168.238.198","GTP <TCP>","110","45861 → 34567 [ACK] Seq=669 Ack=72 Win=65280 Len=0 TSval=1641639204 TSecr=1706027734"
"45","0.061918","1698368211.712309000","10.45.0.3","192.168.238.198","GTP <TCP>","118","36541 → 34567 [SYN] Seq=0 Win=65280 Len=0 MSS=1360 SACK_PERM TSval=1641639217 TSecr=0 WS=128"
"46","0.062226","1698368211.712617000","192.168.238.198","10.45.0.3","GTP <TCP>","118","34567 → 36541 [SYN, ACK] Seq=0 Ack=1 Win=65160 Len=0 MSS=1460 SACK_PERM TSval=1706027747 TSecr=1641639217 WS=128"
"47","0.062687","1698368211.713078000","10.45.0.3","192.168.238.198","GTP <TCP>","110","36541 → 34567 [ACK] Seq=1 Ack=1 Win=65280 Len=0 TSval=1641639218 TSecr=1706027747"
"48","0.063323","1698368211.713714000","10.45.0.3","192.168.238.198","GTP <TCP>","130","36541 → 34567 [PSH, ACK] Seq=1 Ack=1 Win=65280 Len=20 TSval=1641639218 TSecr=1706027747"
"49","0.063370","1698368211.713761000","10.45.0.3","192.168.238.198","GTP <TCP>","386","36541 → 34567 [PSH, ACK] Seq=21 Ack=1 Win=65280 Len=276 TSval=1641639218 TSecr=1706027747"
"50","0.063833","1698368211.714224000","192.168.238.198","10.45.0.3","GTP <TCP>","110","34567 → 36541 [ACK] Seq=1 Ack=21 Win=65152 Len=0 TSval=1706027749 TSecr=1641639218"
"51","0.063974","1698368211.714365000","192.168.238.198","10.45.0.3","GTP <TCP>","110","34567 → 36541 [ACK] Seq=1 Ack=297 Win=64896 Len=0 TSval=1706027749 TSecr=1641639218"
"52","0.064070","1698368211.714461000","192.168.238.198","10.45.0.3","GTP <TCP>","145","34567 → 36541 [PSH, ACK] Seq=1 Ack=297 Win=64896 Len=35 TSval=1706027749 TSecr=1641639218"
"53","0.064517","1698368211.714908000","10.45.0.3","192.168.238.198","GTP <TCP>","110","36541 → 34567 [ACK] Seq=297 Ack=36 Win=65280 Len=0 TSval=1641639219 TSecr=1706027749"
"54","0.064844","1698368211.715235000","10.45.0.3","192.168.238.198","GTP <TCP>","130","36541 → 34567 [PSH, ACK] Seq=297 Ack=36 Win=65280 Len=20 TSval=1641639220 TSecr=1706027749"
"55","0.064878","1698368211.715269000","10.45.0.3","192.168.238.198","GTP <TCP>","461","36541 → 34567 [PSH, ACK] Seq=317 Ack=36 Win=65280 Len=351 TSval=1641639220 TSecr=1706027749"
"56","0.065114","1698368211.715505000","192.168.238.198","10.45.0.3","GTP <TCP>","110","34567 → 36541 [ACK] Seq=36 Ack=668 Win=64640 Len=0 TSval=1706027750 TSecr=1641639220"
"57","0.065173","1698368211.715564000","192.168.238.198","10.45.0.3","GTP <TCP>","145","34567 → 36541 [PSH, ACK] Seq=36 Ack=668 Win=64640 Len=35 TSval=1706027750 TSecr=1641639220"
"58","0.066363","1698368211.716754000","10.45.0.3","192.168.238.198","GTP <TCP>","110","36541 → 34567 [FIN, ACK] Seq=668 Ack=71 Win=65280 Len=0 TSval=1641639221 TSecr=1706027750"
"59","0.066885","1698368211.717276000","192.168.238.198","10.45.0.3","GTP <TCP>","110","34567 → 36541 [FIN, ACK] Seq=71 Ack=669 Win=64640 Len=0 TSval=1706027752 TSecr=1641639221"
"60","0.067425","1698368211.717816000","10.45.0.3","192.168.238.198","GTP <TCP>","118","47183 → 34567 [SYN] Seq=0 Win=65280 Len=0 MSS=1360 SACK_PERM TSval=1641639222 TSecr=0 WS=128"
"61","0.067613","1698368211.718004000","10.45.0.3","192.168.238.198","GTP <TCP>","110","36541 → 34567 [ACK] Seq=669 Ack=72 Win=65280 Len=0 TSval=1641639222 TSecr=1706027752"
"62","0.067671","1698368211.718062000","192.168.238.198","10.45.0.3","GTP <TCP>","118","34567 → 47183 [SYN, ACK] Seq=0 Ack=1 Win=65160 Len=0 MSS=1460 SACK_PERM TSval=1706027753 TSecr=1641639222 WS=128"
"63","0.068122","1698368211.718513000","10.45.0.3","192.168.238.198","GTP <TCP>","110","47183 → 34567 [ACK] Seq=1 Ack=1 Win=65280 Len=0 TSval=1641639223 TSecr=1706027753"
"64","0.069091","1698368211.719482000","10.45.0.3","192.168.238.198","GTP <TCP>","130","47183 → 34567 [PSH, ACK] Seq=1 Ack=1 Win=65280 Len=20 TSval=1641639223 TSecr=1706027753"
"65","0.069158","1698368211.719549000","10.45.0.3","192.168.238.198","GTP <TCP>","386","47183 → 34567 [PSH, ACK] Seq=21 Ack=1 Win=65280 Len=276 TSval=1641639223 TSecr=1706027753"
"66","0.069557","1698368211.719948000","192.168.238.198","10.45.0.3","GTP <TCP>","110","34567 → 47183 [ACK] Seq=1 Ack=21 Win=65152 Len=0 TSval=1706027755 TSecr=1641639223"
"67","0.069672","1698368211.720063000","192.168.238.198","10.45.0.3","GTP <TCP>","110","34567 → 47183 [ACK] Seq=1 Ack=297 Win=64896 Len=0 TSval=1706027755 TSecr=1641639223"
"68","0.069774","1698368211.720165000","192.168.238.198","10.45.0.3","GTP <TCP>","145","34567 → 47183 [PSH, ACK] Seq=1 Ack=297 Win=64896 Len=35 TSval=1706027755 TSecr=1641639223"
"69","0.070592","1698368211.720983000","10.45.0.3","192.168.238.198","GTP <TCP>","110","47183 → 34567 [ACK] Seq=297 Ack=36 Win=65280 Len=0 TSval=1641639225 TSecr=1706027755"
"70","0.070817","1698368211.721208000","10.45.0.3","192.168.238.198","GTP <TCP>","130","47183 → 34567 [PSH, ACK] Seq=297 Ack=36 Win=65280 Len=20 TSval=1641639225 TSecr=1706027755"
"71","0.070874","1698368211.721265000","10.45.0.3","192.168.238.198","GTP <TCP>","461","47183 → 34567 [PSH, ACK] Seq=317 Ack=36 Win=65280 Len=351 TSval=1641639225 TSecr=1706027755"
"72","0.071247","1698368211.721638000","192.168.238.198","10.45.0.3","GTP <TCP>","110","34567 → 47183 [ACK] Seq=36 Ack=668 Win=64640 Len=0 TSval=1706027756 TSecr=1641639225"
"73","0.071334","1698368211.721725000","192.168.238.198","10.45.0.3","GTP <TCP>","145","34567 → 47183 [PSH, ACK] Seq=36 Ack=668 Win=64640 Len=35 TSval=1706027756 TSecr=1641639225"
"74","0.072212","1698368211.722603000","10.45.0.3","192.168.238.198","GTP <TCP>","110","47183 → 34567 [FIN, ACK] Seq=668 Ack=71 Win=65280 Len=0 TSval=1641639227 TSecr=1706027756"
"75","0.072403","1698368211.722794000","192.168.238.198","10.45.0.3","GTP <TCP>","110","34567 → 47183 [FIN, ACK] Seq=71 Ack=669 Win=64640 Len=0 TSval=1706027757 TSecr=1641639227"
"76","0.072915","1698368211.723306000","10.45.0.3","192.168.238.198","GTP <TCP>","110","47183 → 34567 [ACK] Seq=669 Ack=72 Win=65280 Len=0 TSval=1641639228 TSecr=1706027757"
"77","0.184885","1698368211.835276000","10.45.0.3","192.168.238.198","GTP <TCP>","118","35713 → 34567 [SYN] Seq=0 Win=65280 Len=0 MSS=1360 SACK_PERM TSval=1641639340 TSecr=0 WS=128"
"78","0.185113","1698368211.835504000","192.168.238.198","10.45.0.3","GTP <TCP>","118","34567 → 35713 [SYN, ACK] Seq=0 Ack=1 Win=65160 Len=0 MSS=1460 SACK_PERM TSval=1706027870 TSecr=1641639340 WS=128"
"79","0.185868","1698368211.836259000","10.45.0.3","192.168.238.198","GTP <TCP>","110","35713 → 34567 [ACK] Seq=1 Ack=1 Win=65280 Len=0 TSval=1641639341 TSecr=1706027870"
"80","0.186526","1698368211.836917000","10.45.0.3","192.168.238.198","GTP <TCP>","130","35713 → 34567 [PSH, ACK] Seq=1 Ack=1 Win=65280 Len=20 TSval=1641639341 TSecr=1706027870"
"81","0.186679","1698368211.837070000","10.45.0.3","192.168.238.198","GTP <TCP>","386","35713 → 34567 [PSH, ACK] Seq=21 Ack=1 Win=65280 Len=276 TSval=1641639341 TSecr=1706027870"
"82","0.186710","1698368211.837101000","192.168.238.198","10.45.0.3","GTP <TCP>","110","34567 → 35713 [ACK] Seq=1 Ack=21 Win=65152 Len=0 TSval=1706027872 TSecr=1641639341"
"83","0.186890","1698368211.837281000","192.168.238.198","10.45.0.3","GTP <TCP>","110","34567 → 35713 [ACK] Seq=1 Ack=297 Win=64896 Len=0 TSval=1706027872 TSecr=1641639341"
"84","0.186933","1698368211.837324000","192.168.238.198","10.45.0.3","GTP <TCP>","145","34567 → 35713 [PSH, ACK] Seq=1 Ack=297 Win=64896 Len=35 TSval=1706027872 TSecr=1641639341"
"85","0.187728","1698368211.838119000","10.45.0.3","192.168.238.198","GTP <TCP>","110","35713 → 34567 [ACK] Seq=297 Ack=36 Win=65280 Len=0 TSval=1641639342 TSecr=1706027872"
"86","0.187900","1698368211.838291000","10.45.0.3","192.168.238.198","GTP <TCP>","130","35713 → 34567 [PSH, ACK] Seq=297 Ack=36 Win=65280 Len=20 TSval=1641639343 TSecr=1706027872"
"87","0.187945","1698368211.838336000","10.45.0.3","192.168.238.198","GTP <TCP>","461","35713 → 34567 [PSH, ACK] Seq=317 Ack=36 Win=65280 Len=351 TSval=1641639343 TSecr=1706027872"
"88","0.188174","1698368211.838565000","192.168.238.198","10.45.0.3","GTP <TCP>","110","34567 → 35713 [ACK] Seq=36 Ack=668 Win=64640 Len=0 TSval=1706027873 TSecr=1641639343"
"89","0.188220","1698368211.838611000","192.168.238.198","10.45.0.3","GTP <TCP>","145","34567 → 35713 [PSH, ACK] Seq=36 Ack=668 Win=64640 Len=35 TSval=1706027873 TSecr=1641639343"
"90","0.189144","1698368211.839535000","10.45.0.3","192.168.238.198","GTP <TCP>","140","35713 → 34567 [PSH, ACK] Seq=668 Ack=71 Win=65280 Len=30 TSval=1641639344 TSecr=1706027873"
"91","0.189351","1698368211.839742000","192.168.238.198","10.45.0.3","GTP <TCP>","288","34567 → 35713 [PSH, ACK] Seq=71 Ack=698 Win=64640 Len=178 TSval=1706027874 TSecr=1641639344"
"92","0.189918","1698368211.840309000","10.45.0.3","192.168.238.198","GTP <TCP>","145","35713 → 34567 [PSH, ACK] Seq=698 Ack=249 Win=65152 Len=35 TSval=1641639345 TSecr=1706027874"
"93","0.190266","1698368211.840657000","192.168.238.198","10.45.0.3","GTP <TCP>","140","34567 → 35713 [PSH, ACK] Seq=249 Ack=733 Win=64640 Len=30 TSval=1706027875 TSecr=1641639345"
"94","0.190892","1698368211.841283000","10.45.0.3","192.168.238.198","GTP <TCP>","189","35713 → 34567 [PSH, ACK] Seq=733 Ack=279 Win=65152 Len=79 TSval=1641639346 TSecr=1706027875"
"95","0.191610","1698368211.842001000","192.168.238.198","10.45.0.3","GTP <TCP>","130","34567 → 35713 [PSH, ACK] Seq=279 Ack=812 Win=64640 Len=20 TSval=1706027876 TSecr=1641639346"
"96","0.191668","1698368211.842059000","192.168.238.198","10.45.0.3","GTP <TCP>","1458","34567 → 35713 [ACK] Seq=299 Ack=812 Win=64640 Len=1348 TSval=1706027877 TSecr=1641639346"
"97","0.191706","1698368211.842097000","192.168.238.198","10.45.0.3","GTP <TCP>","412","34567 → 35713 [PSH, ACK] Seq=1647 Ack=812 Win=64640 Len=302 TSval=1706027877 TSecr=1641639346"
"98","0.192467","1698368211.842858000","10.45.0.3","192.168.238.198","GTP <TCP>","110","35713 → 34567 [ACK] Seq=812 Ack=1949 Win=63744 Len=0 TSval=1641639347 TSecr=1706027876"
"99","0.192833","1698368211.843224000","10.45.0.3","192.168.238.198","GTP <TCP>","188","35713 → 34567 [PSH, ACK] Seq=812 Ack=1949 Win=64256 Len=78 TSval=1641639348 TSecr=1706027876"
"100","0.193080","1698368211.843471000","192.168.238.198","10.45.0.3","GTP <TCP>","130","34567 → 35713 [PSH, ACK] Seq=1949 Ack=890 Win=64640 Len=20 TSval=1706027878 TSecr=1641639348"
"101","0.193125","1698368211.843516000","192.168.238.198","10.45.0.3","GTP <TCP>","1458","34567 → 35713 [ACK] Seq=1969 Ack=890 Win=64640 Len=1348 TSval=1706027878 TSecr=1641639348"
"102","0.193166","1698368211.843557000","192.168.238.198","10.45.0.3","GTP <TCP>","298","34567 → 35713 [PSH, ACK] Seq=3317 Ack=890 Win=64640 Len=188 TSval=1706027878 TSecr=1641639348"
"103","0.193599","1698368211.843990000","10.45.0.3","192.168.238.198","GTP <TCP>","110","35713 → 34567 [ACK] Seq=890 Ack=3317 Win=63744 Len=0 TSval=1641639348 TSecr=1706027878"
"104","0.193941","1698368211.844332000","10.45.0.3","192.168.238.198","GTP <TCP>","189","35713 → 34567 [PSH, ACK] Seq=890 Ack=3505 Win=64256 Len=79 TSval=1641639349 TSecr=1706027878"
"105","0.194170","1698368211.844561000","192.168.238.198","10.45.0.3","GTP <TCP>","130","34567 → 35713 [PSH, ACK] Seq=3505 Ack=969 Win=64640 Len=20 TSval=1706027879 TSecr=1641639349"
"106","0.194210","1698368211.844601000","192.168.238.198","10.45.0.3","GTP <TCP>","1458","34567 → 35713 [ACK] Seq=3525 Ack=969 Win=64640 Len=1348 TSval=1706027879 TSecr=1641639349"
"107","0.194246","1698368211.844637000","192.168.238.198","10.45.0.3","GTP <TCP>","412","34567 → 35713 [PSH, ACK] Seq=4873 Ack=969 Win=64640 Len=302 TSval=1706027879 TSecr=1641639349"
"108","0.194864","1698368211.845255000","10.45.0.3","192.168.238.198","GTP <TCP>","110","35713 → 34567 [ACK] Seq=969 Ack=4873 Win=64256 Len=0 TSval=1641639350 TSecr=1706027879"
"109","0.194948","1698368211.845339000","10.45.0.3","192.168.238.198","GTP <TCP>","188","35713 → 34567 [PSH, ACK] Seq=969 Ack=5175 Win=64256 Len=78 TSval=1641639350 TSecr=1706027879"
"110","0.195320","1698368211.845711000","192.168.238.198","10.45.0.3","GTP <TCP>","130","34567 → 35713 [PSH, ACK] Seq=5175 Ack=1047 Win=64640 Len=20 TSval=1706027880 TSecr=1641639350"
"111","0.195364","1698368211.845755000","192.168.238.198","10.45.0.3","GTP <TCP>","1458","34567 → 35713 [ACK] Seq=5195 Ack=1047 Win=64640 Len=1348 TSval=1706027880 TSecr=1641639350"
"112","0.195412","1698368211.845803000","192.168.238.198","10.45.0.3","GTP <TCP>","298","34567 → 35713 [PSH, ACK] Seq=6543 Ack=1047 Win=64640 Len=188 TSval=1706027880 TSecr=1641639350"
"113","0.195868","1698368211.846259000","10.45.0.3","192.168.238.198","GTP <TCP>","110","35713 → 34567 [ACK] Seq=1047 Ack=6543 Win=64256 Len=0 TSval=1641639351 TSecr=1706027880"
"114","0.196093","1698368211.846484000","10.45.0.3","192.168.238.198","GTP <TCP>","189","35713 → 34567 [PSH, ACK] Seq=1047 Ack=6731 Win=64256 Len=79 TSval=1641639351 TSecr=1706027880"
"115","0.196451","1698368211.846842000","192.168.238.198","10.45.0.3","GTP <TCP>","130","34567 → 35713 [PSH, ACK] Seq=6731 Ack=1126 Win=64640 Len=20 TSval=1706027881 TSecr=1641639351"
"116","0.196496","1698368211.846887000","192.168.238.198","10.45.0.3","GTP <TCP>","1458","34567 → 35713 [ACK] Seq=6751 Ack=1126 Win=64640 Len=1348 TSval=1706027881 TSecr=1641639351"
"117","0.196537","1698368211.846928000","192.168.238.198","10.45.0.3","GTP <TCP>","412","34567 → 35713 [PSH, ACK] Seq=8099 Ack=1126 Win=64640 Len=302 TSval=1706027881 TSecr=1641639351"
"118","0.197182","1698368211.847573000","10.45.0.3","192.168.238.198","GTP <TCP>","110","35713 → 34567 [ACK] Seq=1126 Ack=8401 Win=63744 Len=0 TSval=1641639352 TSecr=1706027881"
"119","0.197492","1698368211.847883000","10.45.0.3","192.168.238.198","GTP <TCP>","188","35713 → 34567 [PSH, ACK] Seq=1126 Ack=8401 Win=64256 Len=78 TSval=1641639352 TSecr=1706027881"
"120","0.197817","1698368211.848208000","192.168.238.198","10.45.0.3","GTP <TCP>","130","34567 → 35713 [PSH, ACK] Seq=8401 Ack=1204 Win=64640 Len=20 TSval=1706027883 TSecr=1641639352"
"121","0.197862","1698368211.848253000","192.168.238.198","10.45.0.3","GTP <TCP>","1458","34567 → 35713 [ACK] Seq=8421 Ack=1204 Win=64640 Len=1348 TSval=1706027883 TSecr=1641639352"
"122","0.197901","1698368211.848292000","192.168.238.198","10.45.0.3","GTP <TCP>","298","34567 → 35713 [PSH, ACK] Seq=9769 Ack=1204 Win=64640 Len=188 TSval=1706027883 TSecr=1641639352"
"123","0.198438","1698368211.848829000","10.45.0.3","192.168.238.198","GTP <TCP>","110","35713 → 34567 [ACK] Seq=1204 Ack=9957 Win=64256 Len=0 TSval=1641639353 TSecr=1706027883"
"124","0.198718","1698368211.849109000","10.45.0.3","192.168.238.198","GTP <TCP>","189","35713 → 34567 [PSH, ACK] Seq=1204 Ack=9957 Win=64256 Len=79 TSval=1641639353 TSecr=1706027883"
"125","0.199022","1698368211.849413000","192.168.238.198","10.45.0.3","GTP <TCP>","130","34567 → 35713 [PSH, ACK] Seq=9957 Ack=1283 Win=64640 Len=20 TSval=1706027884 TSecr=1641639353"
"126","0.199066","1698368211.849457000","192.168.238.198","10.45.0.3","GTP <TCP>","1458","34567 → 35713 [ACK] Seq=9977 Ack=1283 Win=64640 Len=1348 TSval=1706027884 TSecr=1641639353"
"127","0.199109","1698368211.849500000","192.168.238.198","10.45.0.3","GTP <TCP>","412","34567 → 35713 [PSH, ACK] Seq=11325 Ack=1283 Win=64640 Len=302 TSval=1706027884 TSecr=1641639353"
"128","0.199753","1698368211.850144000","10.45.0.3","192.168.238.198","GTP <TCP>","110","35713 → 34567 [ACK] Seq=1283 Ack=11325 Win=64256 Len=0 TSval=1641639354 TSecr=1706027884"
"129","0.199980","1698368211.850371000","10.45.0.3","192.168.238.198","GTP <TCP>","188","35713 → 34567 [PSH, ACK] Seq=1283 Ack=11627 Win=64256 Len=78 TSval=1641639355 TSecr=1706027884"
"130","0.200312","1698368211.850703000","192.168.238.198","10.45.0.3","GTP <TCP>","130","34567 → 35713 [PSH, ACK] Seq=11627 Ack=1361 Win=64640 Len=20 TSval=1706027885 TSecr=1641639355"
"131","0.200576","1698368211.850967000","192.168.238.198","10.45.0.3","GTP <TCP>","1458","34567 → 35713 [ACK] Seq=11647 Ack=1361 Win=64640 Len=1348 TSval=1706027885 TSecr=1641639355"
"132","0.200620","1698368211.851011000","192.168.238.198","10.45.0.3","GTP <TCP>","298","34567 → 35713 [PSH, ACK] Seq=12995 Ack=1361 Win=64640 Len=188 TSval=1706027885 TSecr=1641639355"
"133","0.201335","1698368211.851726000","10.45.0.3","192.168.238.198","GTP <TCP>","110","35713 → 34567 [ACK] Seq=1361 Ack=12995 Win=64256 Len=0 TSval=1641639356 TSecr=1706027885"
"134","0.201411","1698368211.851802000","10.45.0.3","192.168.238.198","GTP <TCP>","189","35713 → 34567 [PSH, ACK] Seq=1361 Ack=13183 Win=64256 Len=79 TSval=1641639356 TSecr=1706027885"
"135","0.201712","1698368211.852103000","192.168.238.198","10.45.0.3","GTP <TCP>","130","34567 → 35713 [PSH, ACK] Seq=13183 Ack=1440 Win=64640 Len=20 TSval=1706027887 TSecr=1641639356"
"136","0.201758","1698368211.852149000","192.168.238.198","10.45.0.3","GTP <TCP>","1458","34567 → 35713 [ACK] Seq=13203 Ack=1440 Win=64640 Len=1348 TSval=1706027887 TSecr=1641639356"
"137","0.201802","1698368211.852193000","192.168.238.198","10.45.0.3","GTP <TCP>","412","34567 → 35713 [PSH, ACK] Seq=14551 Ack=1440 Win=64640 Len=302 TSval=1706027887 TSecr=1641639356"
"138","0.202437","1698368211.852828000","10.45.0.3","192.168.238.198","GTP <TCP>","110","35713 → 34567 [ACK] Seq=1440 Ack=14551 Win=64256 Len=0 TSval=1641639357 TSecr=1706027887"
"139","0.202701","1698368211.853092000","10.45.0.3","192.168.238.198","GTP <TCP>","188","35713 → 34567 [PSH, ACK] Seq=1440 Ack=14853 Win=64256 Len=78 TSval=1641639358 TSecr=1706027887"
"140","0.202977","1698368211.853368000","192.168.238.198","10.45.0.3","GTP <TCP>","130","34567 → 35713 [PSH, ACK] Seq=14853 Ack=1518 Win=64640 Len=20 TSval=1706027888 TSecr=1641639358"
"141","0.203022","1698368211.853413000","192.168.238.198","10.45.0.3","GTP <TCP>","1458","34567 → 35713 [ACK] Seq=14873 Ack=1518 Win=64640 Len=1348 TSval=1706027888 TSecr=1641639358"
"142","0.203066","1698368211.853457000","192.168.238.198","10.45.0.3","GTP <TCP>","298","34567 → 35713 [PSH, ACK] Seq=16221 Ack=1518 Win=64640 Len=188 TSval=1706027888 TSecr=1641639358"
"143","0.203615","1698368211.854006000","10.45.0.3","192.168.238.198","GTP <TCP>","110","35713 → 34567 [ACK] Seq=1518 Ack=16409 Win=64256 Len=0 TSval=1641639358 TSecr=1706027888"
"144","0.203891","1698368211.854282000","10.45.0.3","192.168.238.198","GTP <TCP>","189","35713 → 34567 [PSH, ACK] Seq=1518 Ack=16409 Win=64256 Len=79 TSval=1641639359 TSecr=1706027888"
"145","0.204205","1698368211.854596000","192.168.238.198","10.45.0.3","GTP <TCP>","130","34567 → 35713 [PSH, ACK] Seq=16409 Ack=1597 Win=64640 Len=20 TSval=1706027889 TSecr=1641639359"
"146","0.204253","1698368211.854644000","192.168.238.198","10.45.0.3","GTP <TCP>","1458","34567 → 35713 [ACK] Seq=16429 Ack=1597 Win=64640 Len=1348 TSval=1706027889 TSecr=1641639359"
"147","0.204304","1698368211.854695000","192.168.238.198","10.45.0.3","GTP <TCP>","412","34567 → 35713 [PSH, ACK] Seq=17777 Ack=1597 Win=64640 Len=302 TSval=1706027889 TSecr=1641639359"
"148","0.205015","1698368211.855406000","10.45.0.3","192.168.238.198","GTP <TCP>","110","35713 → 34567 [ACK] Seq=1597 Ack=18079 Win=63744 Len=0 TSval=1641639360 TSecr=1706027889"
"149","0.205155","1698368211.855546000","10.45.0.3","192.168.238.198","GTP <TCP>","188","35713 → 34567 [PSH, ACK] Seq=1597 Ack=18079 Win=64256 Len=78 TSval=1641639360 TSecr=1706027889"
"150","0.205438","1698368211.855829000","192.168.238.198","10.45.0.3","GTP <TCP>","130","34567 → 35713 [PSH, ACK] Seq=18079 Ack=1675 Win=64640 Len=20 TSval=1706027890 TSecr=1641639360"
"151","0.205487","1698368211.855878000","192.168.238.198","10.45.0.3","GTP <TCP>","1458","34567 → 35713 [ACK] Seq=18099 Ack=1675 Win=64640 Len=1348 TSval=1706027890 TSecr=1641639360"
"152","0.205532","1698368211.855923000","192.168.238.198","10.45.0.3","GTP <TCP>","298","34567 → 35713 [PSH, ACK] Seq=19447 Ack=1675 Win=64640 Len=188 TSval=1706027890 TSecr=1641639360"
"153","0.206068","1698368211.856459000","10.45.0.3","192.168.238.198","GTP <TCP>","110","35713 → 34567 [ACK] Seq=1675 Ack=19635 Win=64256 Len=0 TSval=1641639361 TSecr=1706027890"
"154","0.206437","1698368211.856828000","10.45.0.3","192.168.238.198","GTP <TCP>","189","35713 → 34567 [PSH, ACK] Seq=1675 Ack=19635 Win=64256 Len=79 TSval=1641639361 TSecr=1706027890"
"155","0.206703","1698368211.857094000","192.168.238.198","10.45.0.3","GTP <TCP>","130","34567 → 35713 [PSH, ACK] Seq=19635 Ack=1754 Win=64640 Len=20 TSval=1706027892 TSecr=1641639361"
"156","0.206748","1698368211.857139000","192.168.238.198","10.45.0.3","GTP <TCP>","1458","34567 → 35713 [ACK] Seq=19655 Ack=1754 Win=64640 Len=1348 TSval=1706027892 TSecr=1641639361"
"157","0.206792","1698368211.857183000","192.168.238.198","10.45.0.3","GTP <TCP>","412","34567 → 35713 [PSH, ACK] Seq=21003 Ack=1754 Win=64640 Len=302 TSval=1706027892 TSecr=1641639361"
"158","0.207436","1698368211.857827000","10.45.0.3","192.168.238.198","GTP <TCP>","110","35713 → 34567 [ACK] Seq=1754 Ack=21003 Win=63744 Len=0 TSval=1641639362 TSecr=1706027892"
"159","0.207918","1698368211.858309000","10.45.0.3","192.168.238.198","GTP <TCP>","188","35713 → 34567 [PSH, ACK] Seq=1754 Ack=21305 Win=64256 Len=78 TSval=1641639362 TSecr=1706027892"
"160","0.208373","1698368211.858764000","192.168.238.198","10.45.0.3","GTP <TCP>","130","34567 → 35713 [PSH, ACK] Seq=21305 Ack=1832 Win=64640 Len=20 TSval=1706027893 TSecr=1641639362"
"161","0.208420","1698368211.858811000","192.168.238.198","10.45.0.3","GTP <TCP>","1458","34567 → 35713 [ACK] Seq=21325 Ack=1832 Win=64640 Len=1348 TSval=1706027893 TSecr=1641639362"
"162","0.208458","1698368211.858849000","192.168.238.198","10.45.0.3","GTP <TCP>","298","34567 → 35713 [PSH, ACK] Seq=22673 Ack=1832 Win=64640 Len=188 TSval=1706027893 TSecr=1641639362"
"163","0.209030","1698368211.859421000","10.45.0.3","192.168.238.198","GTP <TCP>","110","35713 → 34567 [ACK] Seq=1832 Ack=22673 Win=64256 Len=0 TSval=1641639364 TSecr=1706027893"
"164","0.209292","1698368211.859683000","10.45.0.3","192.168.238.198","GTP <TCP>","189","35713 → 34567 [PSH, ACK] Seq=1832 Ack=22861 Win=64256 Len=79 TSval=1641639364 TSecr=1706027893"
"165","0.209618","1698368211.860009000","192.168.238.198","10.45.0.3","GTP <TCP>","130","34567 → 35713 [PSH, ACK] Seq=22861 Ack=1911 Win=64640 Len=20 TSval=1706027895 TSecr=1641639364"
"166","0.209663","1698368211.860054000","192.168.238.198","10.45.0.3","GTP <TCP>","1458","34567 → 35713 [ACK] Seq=22881 Ack=1911 Win=64640 Len=1348 TSval=1706027895 TSecr=1641639364"
"167","0.209704","1698368211.860095000","192.168.238.198","10.45.0.3","GTP <TCP>","412","34567 → 35713 [PSH, ACK] Seq=24229 Ack=1911 Win=64640 Len=302 TSval=1706027895 TSecr=1641639364"
"168","0.210234","1698368211.860625000","10.45.0.3","192.168.238.198","GTP <TCP>","110","35713 → 34567 [ACK] Seq=1911 Ack=24531 Win=63744 Len=0 TSval=1641639365 TSecr=1706027895"
"169","0.210402","1698368211.860793000","10.45.0.3","192.168.238.198","GTP <TCP>","188","35713 → 34567 [PSH, ACK] Seq=1911 Ack=24531 Win=64256 Len=78 TSval=1641639365 TSecr=1706027895"
"170","0.210710","1698368211.861101000","192.168.238.198","10.45.0.3","GTP <TCP>","130","34567 → 35713 [PSH, ACK] Seq=24531 Ack=1989 Win=64640 Len=20 TSval=1706027896 TSecr=1641639365"
"171","0.210756","1698368211.861147000","192.168.238.198","10.45.0.3","GTP <TCP>","1458","34567 → 35713 [ACK] Seq=24551 Ack=1989 Win=64640 Len=1348 TSval=1706027896 TSecr=1641639365"
"172","0.210804","1698368211.861195000","192.168.238.198","10.45.0.3","GTP <TCP>","298","34567 → 35713 [PSH, ACK] Seq=25899 Ack=1989 Win=64640 Len=188 TSval=1706027896 TSecr=1641639365"
"173","0.211233","1698368211.861624000","10.45.0.3","192.168.238.198","GTP <TCP>","110","35713 → 34567 [ACK] Seq=1989 Ack=25899 Win=64256 Len=0 TSval=1641639366 TSecr=1706027896"
"174","0.211448","1698368211.861839000","10.45.0.3","192.168.238.198","GTP <TCP>","189","35713 → 34567 [PSH, ACK] Seq=1989 Ack=26087 Win=64256 Len=79 TSval=1641639366 TSecr=1706027896"
"175","0.211885","1698368211.862276000","192.168.238.198","10.45.0.3","GTP <TCP>","130","34567 → 35713 [PSH, ACK] Seq=26087 Ack=2068 Win=64640 Len=20 TSval=1706027897 TSecr=1641639366"
"176","0.211929","1698368211.862320000","192.168.238.198","10.45.0.3","GTP <TCP>","1458","34567 → 35713 [ACK] Seq=26107 Ack=2068 Win=64640 Len=1348 TSval=1706027897 TSecr=1641639366"
"177","0.211979","1698368211.862370000","192.168.238.198","10.45.0.3","GTP <TCP>","412","34567 → 35713 [PSH, ACK] Seq=27455 Ack=2068 Win=64640 Len=302 TSval=1706027897 TSecr=1641639366"
"178","0.212511","1698368211.862902000","10.45.0.3","192.168.238.198","GTP <TCP>","110","35713 → 34567 [ACK] Seq=2068 Ack=27455 Win=64256 Len=0 TSval=1641639367 TSecr=1706027897"
"179","0.213164","1698368211.863555000","10.45.0.3","192.168.238.198","GTP <TCP>","188","35713 → 34567 [PSH, ACK] Seq=2068 Ack=27757 Win=64256 Len=78 TSval=1641639368 TSecr=1706027897"
"180","0.213400","1698368211.863791000","192.168.238.198","10.45.0.3","GTP <TCP>","130","34567 → 35713 [PSH, ACK] Seq=27757 Ack=2146 Win=64640 Len=20 TSval=1706027898 TSecr=1641639368"
"181","0.213445","1698368211.863836000","192.168.238.198","10.45.0.3","GTP <TCP>","1458","34567 → 35713 [ACK] Seq=27777 Ack=2146 Win=64640 Len=1348 TSval=1706027898 TSecr=1641639368"
"182","0.213489","1698368211.863880000","192.168.238.198","10.45.0.3","GTP <TCP>","298","34567 → 35713 [PSH, ACK] Seq=29125 Ack=2146 Win=64640 Len=188 TSval=1706027898 TSecr=1641639368"
"183","0.214157","1698368211.864548000","10.45.0.3","192.168.238.198","GTP <TCP>","110","35713 → 34567 [ACK] Seq=2146 Ack=29125 Win=64256 Len=0 TSval=1641639369 TSecr=1706027898"
"184","0.214507","1698368211.864898000","10.45.0.3","192.168.238.198","GTP <TCP>","189","35713 → 34567 [PSH, ACK] Seq=2146 Ack=29313 Win=64256 Len=79 TSval=1641639369 TSecr=1706027898"
"185","0.214743","1698368211.865134000","192.168.238.198","10.45.0.3","GTP <TCP>","130","34567 → 35713 [PSH, ACK] Seq=29313 Ack=2225 Win=64640 Len=20 TSval=1706027900 TSecr=1641639369"
"186","0.214794","1698368211.865185000","192.168.238.198","10.45.0.3","GTP <TCP>","1458","34567 → 35713 [ACK] Seq=29333 Ack=2225 Win=64640 Len=1348 TSval=1706027900 TSecr=1641639369"
"187","0.214846","1698368211.865237000","192.168.238.198","10.45.0.3","GTP <TCP>","412","34567 → 35713 [PSH, ACK] Seq=30681 Ack=2225 Win=64640 Len=302 TSval=1706027900 TSecr=1641639369"
"188","0.215339","1698368211.865730000","10.45.0.3","192.168.238.198","GTP <TCP>","110","35713 → 34567 [ACK] Seq=2225 Ack=30983 Win=63744 Len=0 TSval=1641639370 TSecr=1706027900"
"189","0.215748","1698368211.866139000","10.45.0.3","192.168.238.198","GTP <TCP>","188","35713 → 34567 [PSH, ACK] Seq=2225 Ack=30983 Win=64256 Len=78 TSval=1641639370 TSecr=1706027900"
"190","0.216114","1698368211.866505000","192.168.238.198","10.45.0.3","GTP <TCP>","130","34567 → 35713 [PSH, ACK] Seq=30983 Ack=2303 Win=64640 Len=20 TSval=1706027901 TSecr=1641639370"
"191","0.216192","1698368211.866583000","192.168.238.198","10.45.0.3","GTP <TCP>","1458","34567 → 35713 [ACK] Seq=31003 Ack=2303 Win=64640 Len=1348 TSval=1706027901 TSecr=1641639370"
"192","0.216233","1698368211.866624000","192.168.238.198","10.45.0.3","GTP <TCP>","298","34567 → 35713 [PSH, ACK] Seq=32351 Ack=2303 Win=64640 Len=188 TSval=1706027901 TSecr=1641639370"
"193","0.216786","1698368211.867177000","10.45.0.3","192.168.238.198","GTP <TCP>","110","35713 → 34567 [ACK] Seq=2303 Ack=32351 Win=64256 Len=0 TSval=1641639372 TSecr=1706027901"
"194","0.217137","1698368211.867528000","10.45.0.3","192.168.238.198","GTP <TCP>","189","35713 → 34567 [PSH, ACK] Seq=2303 Ack=32539 Win=64256 Len=79 TSval=1641639372 TSecr=1706027901"
"195","0.217407","1698368211.867798000","192.168.238.198","10.45.0.3","GTP <TCP>","130","34567 → 35713 [PSH, ACK] Seq=32539 Ack=2382 Win=64640 Len=20 TSval=1706027902 TSecr=1641639372"
"196","0.217448","1698368211.867839000","192.168.238.198","10.45.0.3","GTP <TCP>","1458","34567 → 35713 [ACK] Seq=32559 Ack=2382 Win=64640 Len=1348 TSval=1706027902 TSecr=1641639372"
"197","0.217490","1698368211.867881000","192.168.238.198","10.45.0.3","GTP <TCP>","412","34567 → 35713 [PSH, ACK] Seq=33907 Ack=2382 Win=64640 Len=302 TSval=1706027902 TSecr=1641639372"
"198","0.218242","1698368211.868633000","10.45.0.3","192.168.238.198","GTP <TCP>","110","35713 → 34567 [ACK] Seq=2382 Ack=33907 Win=64256 Len=0 TSval=1641639373 TSecr=1706027902"
"199","0.218276","1698368211.868667000","10.45.0.3","192.168.238.198","GTP <TCP>","188","35713 → 34567 [PSH, ACK] Seq=2382 Ack=34209 Win=64256 Len=78 TSval=1641639373 TSecr=1706027902"
"200","0.218488","1698368211.868879000","192.168.238.198","10.45.0.3","GTP <TCP>","130","34567 → 35713 [PSH, ACK] Seq=34209 Ack=2460 Win=64640 Len=20 TSval=1706027903 TSecr=1641639373"
"201","0.218539","1698368211.868930000","192.168.238.198","10.45.0.3","GTP <TCP>","1458","34567 → 35713 [ACK] Seq=34229 Ack=2460 Win=64640 Len=1348 TSval=1706027904 TSecr=1641639373"
"202","0.218590","1698368211.868981000","192.168.238.198","10.45.0.3","GTP <TCP>","298","34567 → 35713 [PSH, ACK] Seq=35577 Ack=2460 Win=64640 Len=188 TSval=1706027904 TSecr=1641639373"
"203","0.219198","1698368211.869589000","10.45.0.3","192.168.238.198","GTP <TCP>","110","35713 → 34567 [ACK] Seq=2460 Ack=35765 Win=64256 Len=0 TSval=1641639374 TSecr=1706027903"
"204","0.219447","1698368211.869838000","10.45.0.3","192.168.238.198","GTP <TCP>","189","35713 → 34567 [PSH, ACK] Seq=2460 Ack=35765 Win=64256 Len=79 TSval=1641639374 TSecr=1706027903"
"205","0.219737","1698368211.870128000","192.168.238.198","10.45.0.3","GTP <TCP>","130","34567 → 35713 [PSH, ACK] Seq=35765 Ack=2539 Win=64640 Len=20 TSval=1706027905 TSecr=1641639374"
"206","0.219791","1698368211.870182000","192.168.238.198","10.45.0.3","GTP <TCP>","1458","34567 → 35713 [ACK] Seq=35785 Ack=2539 Win=64640 Len=1348 TSval=1706027905 TSecr=1641639374"
"207","0.219837","1698368211.870228000","192.168.238.198","10.45.0.3","GTP <TCP>","412","34567 → 35713 [PSH, ACK] Seq=37133 Ack=2539 Win=64640 Len=302 TSval=1706027905 TSecr=1641639374"
"208","0.220677","1698368211.871068000","10.45.0.3","192.168.238.198","GTP <TCP>","110","35713 → 34567 [ACK] Seq=2539 Ack=37133 Win=64256 Len=0 TSval=1641639375 TSecr=1706027905"
"209","0.220821","1698368211.871212000","10.45.0.3","192.168.238.198","GTP <TCP>","188","35713 → 34567 [PSH, ACK] Seq=2539 Ack=37435 Win=64256 Len=78 TSval=1641639376 TSecr=1706027905"
"210","0.221192","1698368211.871583000","192.168.238.198","10.45.0.3","GTP <TCP>","130","34567 → 35713 [PSH, ACK] Seq=37435 Ack=2617 Win=64640 Len=20 TSval=1706027906 TSecr=1641639376"
"211","0.221234","1698368211.871625000","192.168.238.198","10.45.0.3","GTP <TCP>","1458","34567 → 35713 [ACK] Seq=37455 Ack=2617 Win=64640 Len=1348 TSval=1706027906 TSecr=1641639376"
"212","0.221275","1698368211.871666000","192.168.238.198","10.45.0.3","GTP <TCP>","298","34567 → 35713 [PSH, ACK] Seq=38803 Ack=2617 Win=64640 Len=188 TSval=1706027906 TSecr=1641639376"
"213","0.221862","1698368211.872253000","10.45.0.3","192.168.238.198","GTP <TCP>","110","35713 → 34567 [ACK] Seq=2617 Ack=38991 Win=64256 Len=0 TSval=1641639377 TSecr=1706027906"
"214","0.221994","1698368211.872385000","10.45.0.3","192.168.238.198","GTP <TCP>","189","35713 → 34567 [PSH, ACK] Seq=2617 Ack=38991 Win=64256 Len=79 TSval=1641639377 TSecr=1706027906"
"215","0.222234","1698368211.872625000","192.168.238.198","10.45.0.3","GTP <TCP>","130","34567 → 35713 [PSH, ACK] Seq=38991 Ack=2696 Win=64640 Len=20 TSval=1706027907 TSecr=1641639377"
"216","0.222277","1698368211.872668000","192.168.238.198","10.45.0.3","GTP <TCP>","1458","34567 → 35713 [ACK] Seq=39011 Ack=2696 Win=64640 Len=1348 TSval=1706027907 TSecr=1641639377"
"217","0.222320","1698368211.872711000","192.168.238.198","10.45.0.3","GTP <TCP>","412","34567 → 35713 [PSH, ACK] Seq=40359 Ack=2696 Win=64640 Len=302 TSval=1706027907 TSecr=1641639377"
"218","0.222989","1698368211.873380000","10.45.0.3","192.168.238.198","GTP <TCP>","110","35713 → 34567 [ACK] Seq=2696 Ack=40359 Win=63744 Len=0 TSval=1641639378 TSecr=1706027907"
"219","0.223203","1698368211.873594000","10.45.0.3","192.168.238.198","GTP <TCP>","188","35713 → 34567 [PSH, ACK] Seq=2696 Ack=40661 Win=64256 Len=78 TSval=1641639378 TSecr=1706027907"
"220","0.223636","1698368211.874027000","192.168.238.198","10.45.0.3","GTP <TCP>","130","34567 → 35713 [PSH, ACK] Seq=40661 Ack=2774 Win=64640 Len=20 TSval=1706027908 TSecr=1641639378"
