"1","0.000000","1698367969.126657000","10.45.0.3","192.168.238.198","GTP <TCP>","118","40445 → 34567 [SYN] Seq=0 Win=65280 Len=0 MSS=1360 SACK_PERM TSval=1641396631 TSecr=0 WS=128"
"2","0.001390","1698367969.128047000","192.168.238.198","10.45.0.3","GTP <TCP>","118","34567 → 40445 [SYN, ACK] Seq=0 Ack=1 Win=65160 Len=0 MSS=1460 SACK_PERM TSval=1705785163 TSecr=1641396631 WS=128"
"3","0.002033","1698367969.128690000","10.45.0.3","192.168.238.198","GTP <TCP>","110","40445 → 34567 [ACK] Seq=1 Ack=1 Win=65280 Len=0 TSval=1641396633 TSecr=1705785163"
"4","0.003323","1698367969.129980000","10.45.0.3","192.168.238.198","GTP <TCP>","110","40445 → 34567 [FIN, ACK] Seq=1 Ack=1 Win=65280 Len=0 TSval=1641396634 TSecr=1705785163"
"5","0.003626","1698367969.130283000","192.168.238.198","10.45.0.3","GTP <TCP>","110","34567 → 40445 [FIN, ACK] Seq=1 Ack=2 Win=65280 Len=0 TSval=1705785165 TSecr=1641396634"
"6","0.004156","1698367969.130813000","10.45.0.3","192.168.238.198","GTP <TCP>","110","40445 → 34567 [ACK] Seq=2 Ack=2 Win=65280 Len=0 TSval=1641396635 TSecr=1705785165"
"7","0.007934","1698367969.134591000","10.45.0.3","192.168.238.198","GTP <TCP>","118","50293 → 34567 [SYN] Seq=0 Win=65280 Len=0 MSS=1360 SACK_PERM TSval=1641396639 TSecr=0 WS=128"
"8","0.008078","1698367969.134735000","192.168.238.198","10.45.0.3","GTP <TCP>","118","34567 → 50293 [SYN, ACK] Seq=0 Ack=1 Win=65160 Len=0 MSS=1460 SACK_PERM TSval=1705785169 TSecr=1641396639 WS=128"
"9","0.008590","1698367969.135247000","10.45.0.3","192.168.238.198","GTP <TCP>","110","50293 → 34567 [ACK] Seq=1 Ack=1 Win=65280 Len=0 TSval=1641396640 TSecr=1705785169"
"10","0.008912","1698367969.135569000","10.45.0.3","192.168.238.198","GTP <TCP>","110","50293 → 34567 [FIN, ACK] Seq=1 Ack=1 Win=65280 Len=0 TSval=1641396640 TSecr=1705785169"
"11","0.009232","1698367969.135889000","192.168.238.198","10.45.0.3","GTP <TCP>","110","34567 → 50293 [FIN, ACK] Seq=1 Ack=2 Win=65280 Len=0 TSval=1705785170 TSecr=1641396640"
"12","0.009678","1698367969.136335000","10.45.0.3","192.168.238.198","GTP <TCP>","110","50293 → 34567 [ACK] Seq=2 Ack=2 Win=65280 Len=0 TSval=1641396641 TSecr=1705785170"
"13","0.029889","1698367969.156546000","10.45.0.3","192.168.238.198","GTP <TCP>","118","36375 → 34567 [SYN] Seq=0 Win=65280 Len=0 MSS=1360 SACK_PERM TSval=1641396661 TSecr=0 WS=128"
"14","0.030153","1698367969.156810000","192.168.238.198","10.45.0.3","GTP <TCP>","118","34567 → 36375 [SYN, ACK] Seq=0 Ack=1 Win=65160 Len=0 MSS=1460 SACK_PERM TSval=1705785191 TSecr=1641396661 WS=128"
"15","0.030608","1698367969.157265000","10.45.0.3","192.168.238.198","GTP <TCP>","110","36375 → 34567 [ACK] Seq=1 Ack=1 Win=65280 Len=0 TSval=1641396662 TSecr=1705785191"
"16","0.030944","1698367969.157601000","10.45.0.3","192.168.238.198","GTP <TCP>","130","36375 → 34567 [PSH, ACK] Seq=1 Ack=1 Win=65280 Len=20 TSval=1641396662 TSecr=1705785191"
"17","0.030981","1698367969.157638000","10.45.0.3","192.168.238.198","GTP <TCP>","386","36375 → 34567 [PSH, ACK] Seq=21 Ack=1 Win=65280 Len=276 TSval=1641396662 TSecr=1705785191"
"18","0.031092","1698367969.157749000","192.168.238.198","10.45.0.3","GTP <TCP>","110","34567 → 36375 [ACK] Seq=1 Ack=21 Win=65152 Len=0 TSval=1705785192 TSecr=1641396662"
"19","0.031147","1698367969.157804000","192.168.238.198","10.45.0.3","GTP <TCP>","110","34567 → 36375 [ACK] Seq=1 Ack=297 Win=64896 Len=0 TSval=1705785192 TSecr=1641396662"
"20","0.031190","1698367969.157847000","192.168.238.198","10.45.0.3","GTP <TCP>","145","34567 → 36375 [PSH, ACK] Seq=1 Ack=297 Win=64896 Len=35 TSval=1705785192 TSecr=1641396662"
"21","0.031809","1698367969.158466000","10.45.0.3","192.168.238.198","GTP <TCP>","110","36375 → 34567 [ACK] Seq=297 Ack=36 Win=65280 Len=0 TSval=1641396663 TSecr=1705785192"
"22","0.032078","1698367969.158735000","10.45.0.3","192.168.238.198","GTP <TCP>","130","36375 → 34567 [PSH, ACK] Seq=297 Ack=36 Win=65280 Len=20 TSval=1641396663 TSecr=1705785192"
"23","0.032109","1698367969.158766000","10.45.0.3","192.168.238.198","GTP <TCP>","461","36375 → 34567 [PSH, ACK] Seq=317 Ack=36 Win=65280 Len=351 TSval=1641396663 TSecr=1705785192"
"24","0.032272","1698367969.158929000","192.168.238.198","10.45.0.3","GTP <TCP>","110","34567 → 36375 [ACK] Seq=36 Ack=668 Win=64640 Len=0 TSval=1705785194 TSecr=1641396663"
"25","0.032382","1698367969.159039000","192.168.238.198","10.45.0.3","GTP <TCP>","145","34567 → 36375 [PSH, ACK] Seq=36 Ack=668 Win=64640 Len=35 TSval=1705785194 TSecr=1641396663"
"26","0.033101","1698367969.159758000","10.45.0.3","192.168.238.198","GTP <TCP>","110","36375 → 34567 [FIN, ACK] Seq=668 Ack=71 Win=65280 Len=0 TSval=1641396664 TSecr=1705785194"
"27","0.033339","1698367969.159996000","192.168.238.198","10.45.0.3","GTP <TCP>","110","34567 → 36375 [FIN, ACK] Seq=71 Ack=669 Win=64640 Len=0 TSval=1705785195 TSecr=1641396664"
"28","0.033840","1698367969.160497000","10.45.0.3","192.168.238.198","GTP <TCP>","110","36375 → 34567 [ACK] Seq=669 Ack=72 Win=65280 Len=0 TSval=1641396665 TSecr=1705785195"
"29","0.034064","1698367969.160721000","10.45.0.3","192.168.238.198","GTP <TCP>","118","36091 → 34567 [SYN] Seq=0 Win=65280 Len=0 MSS=1360 SACK_PERM TSval=1641396665 TSecr=0 WS=128"
"30","0.034214","1698367969.160871000","192.168.238.198","10.45.0.3","GTP <TCP>","118","34567 → 36091 [SYN, ACK] Seq=0 Ack=1 Win=65160 Len=0 MSS=1460 SACK_PERM TSval=1705785195 TSecr=1641396665 WS=128"
"31","0.034636","1698367969.161293000","10.45.0.3","192.168.238.198","GTP <TCP>","110","36091 → 34567 [ACK] Seq=1 Ack=1 Win=65280 Len=0 TSval=1641396666 TSecr=1705785195"
"32","0.034908","1698367969.161565000","10.45.0.3","192.168.238.198","GTP <TCP>","130","36091 → 34567 [PSH, ACK] Seq=1 Ack=1 Win=65280 Len=20 TSval=1641396666 TSecr=1705785195"
"33","0.034944","1698367969.161601000","10.45.0.3","192.168.238.198","GTP <TCP>","386","36091 → 34567 [PSH, ACK] Seq=21 Ack=1 Win=65280 Len=276 TSval=1641396666 TSecr=1705785195"
"34","0.035394","1698367969.162051000","192.168.238.198","10.45.0.3","GTP <TCP>","110","34567 → 36091 [ACK] Seq=1 Ack=21 Win=65152 Len=0 TSval=1705785196 TSecr=1641396666"
"35","0.035441","1698367969.162098000","192.168.238.198","10.45.0.3","GTP <TCP>","110","34567 → 36091 [ACK] Seq=1 Ack=297 Win=64896 Len=0 TSval=1705785197 TSecr=1641396666"
"36","0.035484","1698367969.162141000","192.168.238.198","10.45.0.3","GTP <TCP>","145","34567 → 36091 [PSH, ACK] Seq=1 Ack=297 Win=64896 Len=35 TSval=1705785197 TSecr=1641396666"
"37","0.035949","1698367969.162606000","10.45.0.3","192.168.238.198","GTP <TCP>","110","36091 → 34567 [ACK] Seq=297 Ack=36 Win=65280 Len=0 TSval=1641396667 TSecr=1705785197"
"38","0.036098","1698367969.162755000","10.45.0.3","192.168.238.198","GTP <TCP>","130","36091 → 34567 [PSH, ACK] Seq=297 Ack=36 Win=65280 Len=20 TSval=1641396667 TSecr=1705785197"
"39","0.036147","1698367969.162804000","10.45.0.3","192.168.238.198","GTP <TCP>","461","36091 → 34567 [PSH, ACK] Seq=317 Ack=36 Win=65280 Len=351 TSval=1641396667 TSecr=1705785197"
"40","0.036265","1698367969.162922000","192.168.238.198","10.45.0.3","GTP <TCP>","110","34567 → 36091 [ACK] Seq=36 Ack=668 Win=64640 Len=0 TSval=1705785198 TSecr=1641396667"
"41","0.036354","1698367969.163011000","192.168.238.198","10.45.0.3","GTP <TCP>","145","34567 → 36091 [PSH, ACK] Seq=36 Ack=668 Win=64640 Len=35 TSval=1705785198 TSecr=1641396667"
"42","0.037163","1698367969.163820000","10.45.0.3","192.168.238.198","GTP <TCP>","110","36091 → 34567 [FIN, ACK] Seq=668 Ack=71 Win=65280 Len=0 TSval=1641396668 TSecr=1705785198"
"43","0.037366","1698367969.164023000","192.168.238.198","10.45.0.3","GTP <TCP>","110","34567 → 36091 [FIN, ACK] Seq=71 Ack=669 Win=64640 Len=0 TSval=1705785199 TSecr=1641396668"
"44","0.037938","1698367969.164595000","10.45.0.3","192.168.238.198","GTP <TCP>","110","36091 → 34567 [ACK] Seq=669 Ack=72 Win=65280 Len=0 TSval=1641396669 TSecr=1705785199"
"45","0.050083","1698367969.176740000","10.45.0.3","192.168.238.198","GTP <TCP>","118","45119 → 34567 [SYN] Seq=0 Win=65280 Len=0 MSS=1360 SACK_PERM TSval=1641396681 TSecr=0 WS=128"
"46","0.050360","1698367969.177017000","192.168.238.198","10.45.0.3","GTP <TCP>","118","34567 → 45119 [SYN, ACK] Seq=0 Ack=1 Win=65160 Len=0 MSS=1460 SACK_PERM TSval=1705785212 TSecr=1641396681 WS=128"
"47","0.050889","1698367969.177546000","10.45.0.3","192.168.238.198","GTP <TCP>","110","45119 → 34567 [ACK] Seq=1 Ack=1 Win=65280 Len=0 TSval=1641396682 TSecr=1705785212"
"48","0.051162","1698367969.177819000","10.45.0.3","192.168.238.198","GTP <TCP>","130","45119 → 34567 [PSH, ACK] Seq=1 Ack=1 Win=65280 Len=20 TSval=1641396682 TSecr=1705785212"
"49","0.051222","1698367969.177879000","10.45.0.3","192.168.238.198","GTP <TCP>","386","45119 → 34567 [PSH, ACK] Seq=21 Ack=1 Win=65280 Len=276 TSval=1641396682 TSecr=1705785212"
"50","0.051410","1698367969.178067000","192.168.238.198","10.45.0.3","GTP <TCP>","110","34567 → 45119 [ACK] Seq=1 Ack=21 Win=65152 Len=0 TSval=1705785213 TSecr=1641396682"
"51","0.051454","1698367969.178111000","192.168.238.198","10.45.0.3","GTP <TCP>","110","34567 → 45119 [ACK] Seq=1 Ack=297 Win=64896 Len=0 TSval=1705785213 TSecr=1641396682"
"52","0.051491","1698367969.178148000","192.168.238.198","10.45.0.3","GTP <TCP>","145","34567 → 45119 [PSH, ACK] Seq=1 Ack=297 Win=64896 Len=35 TSval=1705785213 TSecr=1641396682"
"53","0.052000","1698367969.178657000","10.45.0.3","192.168.238.198","GTP <TCP>","110","45119 → 34567 [ACK] Seq=297 Ack=36 Win=65280 Len=0 TSval=1641396683 TSecr=1705785213"
"54","0.052178","1698367969.178835000","10.45.0.3","192.168.238.198","GTP <TCP>","130","45119 → 34567 [PSH, ACK] Seq=297 Ack=36 Win=65280 Len=20 TSval=1641396683 TSecr=1705785213"
"55","0.052210","1698367969.178867000","10.45.0.3","192.168.238.198","GTP <TCP>","461","45119 → 34567 [PSH, ACK] Seq=317 Ack=36 Win=65280 Len=351 TSval=1641396683 TSecr=1705785213"
"56","0.052328","1698367969.178985000","192.168.238.198","10.45.0.3","GTP <TCP>","110","34567 → 45119 [ACK] Seq=36 Ack=668 Win=64640 Len=0 TSval=1705785214 TSecr=1641396683"
"57","0.052395","1698367969.179052000","192.168.238.198","10.45.0.3","GTP <TCP>","145","34567 → 45119 [PSH, ACK] Seq=36 Ack=668 Win=64640 Len=35 TSval=1705785214 TSecr=1641396683"
"58","0.053309","1698367969.179966000","10.45.0.3","192.168.238.198","GTP <TCP>","110","45119 → 34567 [FIN, ACK] Seq=668 Ack=71 Win=65280 Len=0 TSval=1641396684 TSecr=1705785214"
"59","0.053640","1698367969.180297000","192.168.238.198","10.45.0.3","GTP <TCP>","110","34567 → 45119 [FIN, ACK] Seq=71 Ack=669 Win=64640 Len=0 TSval=1705785215 TSecr=1641396684"
"60","0.054357","1698367969.181014000","10.45.0.3","192.168.238.198","GTP <TCP>","110","45119 → 34567 [ACK] Seq=669 Ack=72 Win=65280 Len=0 TSval=1641396685 TSecr=1705785215"
"61","0.054438","1698367969.181095000","10.45.0.3","192.168.238.198","GTP <TCP>","118","36313 → 34567 [SYN] Seq=0 Win=65280 Len=0 MSS=1360 SACK_PERM TSval=1641396685 TSecr=0 WS=128"
"62","0.054649","1698367969.181306000","192.168.238.198","10.45.0.3","GTP <TCP>","118","34567 → 36313 [SYN, ACK] Seq=0 Ack=1 Win=65160 Len=0 MSS=1460 SACK_PERM TSval=1705785216 TSecr=1641396685 WS=128"
"63","0.055291","1698367969.181948000","10.45.0.3","192.168.238.198","GTP <TCP>","110","36313 → 34567 [ACK] Seq=1 Ack=1 Win=65280 Len=0 TSval=1641396686 TSecr=1705785216"
"64","0.056364","1698367969.183021000","10.45.0.3","192.168.238.198","GTP <TCP>","130","36313 → 34567 [PSH, ACK] Seq=1 Ack=1 Win=65280 Len=20 TSval=1641396687 TSecr=1705785216"
"65","0.056412","1698367969.183069000","10.45.0.3","192.168.238.198","GTP <TCP>","386","36313 → 34567 [PSH, ACK] Seq=21 Ack=1 Win=65280 Len=276 TSval=1641396687 TSecr=1705785216"
"66","0.056566","1698367969.183223000","192.168.238.198","10.45.0.3","GTP <TCP>","110","34567 → 36313 [ACK] Seq=1 Ack=21 Win=65152 Len=0 TSval=1705785218 TSecr=1641396687"
"67","0.056614","1698367969.183271000","192.168.238.198","10.45.0.3","GTP <TCP>","110","34567 → 36313 [ACK] Seq=1 Ack=297 Win=64896 Len=0 TSval=1705785218 TSecr=1641396687"
"68","0.056659","1698367969.183316000","192.168.238.198","10.45.0.3","GTP <TCP>","145","34567 → 36313 [PSH, ACK] Seq=1 Ack=297 Win=64896 Len=35 TSval=1705785218 TSecr=1641396687"
"69","0.057159","1698367969.183816000","10.45.0.3","192.168.238.198","GTP <TCP>","110","36313 → 34567 [ACK] Seq=297 Ack=36 Win=65280 Len=0 TSval=1641396688 TSecr=1705785218"
"70","0.057450","1698367969.184107000","10.45.0.3","192.168.238.198","GTP <TCP>","130","36313 → 34567 [PSH, ACK] Seq=297 Ack=36 Win=65280 Len=20 TSval=1641396688 TSecr=1705785218"
"71","0.057498","1698367969.184155000","10.45.0.3","192.168.238.198","GTP <TCP>","461","36313 → 34567 [PSH, ACK] Seq=317 Ack=36 Win=65280 Len=351 TSval=1641396688 TSecr=1705785218"
"72","0.057769","1698367969.184426000","192.168.238.198","10.45.0.3","GTP <TCP>","110","34567 → 36313 [ACK] Seq=36 Ack=668 Win=64640 Len=0 TSval=1705785219 TSecr=1641396688"
"73","0.057932","1698367969.184589000","192.168.238.198","10.45.0.3","GTP <TCP>","145","34567 → 36313 [PSH, ACK] Seq=36 Ack=668 Win=64640 Len=35 TSval=1705785219 TSecr=1641396688"
"74","0.058941","1698367969.185598000","10.45.0.3","192.168.238.198","GTP <TCP>","110","36313 → 34567 [FIN, ACK] Seq=668 Ack=71 Win=65280 Len=0 TSval=1641396690 TSecr=1705785219"
"75","0.059310","1698367969.185967000","192.168.238.198","10.45.0.3","GTP <TCP>","110","34567 → 36313 [FIN, ACK] Seq=71 Ack=669 Win=64640 Len=0 TSval=1705785220 TSecr=1641396690"
"76","0.059833","1698367969.186490000","10.45.0.3","192.168.238.198","GTP <TCP>","110","36313 → 34567 [ACK] Seq=669 Ack=72 Win=65280 Len=0 TSval=1641396691 TSecr=1705785220"
"77","0.182954","1698367969.309611000","10.45.0.3","192.168.238.198","GTP <TCP>","118","58763 → 34567 [SYN] Seq=0 Win=65280 Len=0 MSS=1360 SACK_PERM TSval=1641396814 TSecr=0 WS=128"
"78","0.183256","1698367969.309913000","192.168.238.198","10.45.0.3","GTP <TCP>","118","34567 → 58763 [SYN, ACK] Seq=0 Ack=1 Win=65160 Len=0 MSS=1460 SACK_PERM TSval=1705785344 TSecr=1641396814 WS=128"
"79","0.183776","1698367969.310433000","10.45.0.3","192.168.238.198","GTP <TCP>","110","58763 → 34567 [ACK] Seq=1 Ack=1 Win=65280 Len=0 TSval=1641396815 TSecr=1705785344"
"80","0.184039","1698367969.310696000","10.45.0.3","192.168.238.198","GTP <TCP>","130","58763 → 34567 [PSH, ACK] Seq=1 Ack=1 Win=65280 Len=20 TSval=1641396815 TSecr=1705785344"
"81","0.184109","1698367969.310766000","10.45.0.3","192.168.238.198","GTP <TCP>","386","58763 → 34567 [PSH, ACK] Seq=21 Ack=1 Win=65280 Len=276 TSval=1641396815 TSecr=1705785344"
"82","0.184409","1698367969.311066000","192.168.238.198","10.45.0.3","GTP <TCP>","110","34567 → 58763 [ACK] Seq=1 Ack=21 Win=65152 Len=0 TSval=1705785345 TSecr=1641396815"
"83","0.184459","1698367969.311116000","192.168.238.198","10.45.0.3","GTP <TCP>","110","34567 → 58763 [ACK] Seq=1 Ack=297 Win=64896 Len=0 TSval=1705785345 TSecr=1641396815"
"84","0.184509","1698367969.311166000","192.168.238.198","10.45.0.3","GTP <TCP>","145","34567 → 58763 [PSH, ACK] Seq=1 Ack=297 Win=64896 Len=35 TSval=1705785346 TSecr=1641396815"
"85","0.184927","1698367969.311584000","10.45.0.3","192.168.238.198","GTP <TCP>","110","58763 → 34567 [ACK] Seq=297 Ack=36 Win=65280 Len=0 TSval=1641396816 TSecr=1705785346"
"86","0.185106","1698367969.311763000","10.45.0.3","192.168.238.198","GTP <TCP>","130","58763 → 34567 [PSH, ACK] Seq=297 Ack=36 Win=65280 Len=20 TSval=1641396816 TSecr=1705785346"
"87","0.185141","1698367969.311798000","10.45.0.3","192.168.238.198","GTP <TCP>","461","58763 → 34567 [PSH, ACK] Seq=317 Ack=36 Win=65280 Len=351 TSval=1641396816 TSecr=1705785346"
"88","0.185253","1698367969.311910000","192.168.238.198","10.45.0.3","GTP <TCP>","110","34567 → 58763 [ACK] Seq=36 Ack=668 Win=64640 Len=0 TSval=1705785347 TSecr=1641396816"
"89","0.185562","1698367969.312219000","192.168.238.198","10.45.0.3","GTP <TCP>","145","34567 → 58763 [PSH, ACK] Seq=36 Ack=668 Win=64640 Len=35 TSval=1705785347 TSecr=1641396816"
"90","0.186077","1698367969.312734000","10.45.0.3","192.168.238.198","GTP <TCP>","140","58763 → 34567 [PSH, ACK] Seq=668 Ack=71 Win=65280 Len=30 TSval=1641396817 TSecr=1705785347"
"91","0.186255","1698367969.312912000","192.168.238.198","10.45.0.3","GTP <TCP>","288","34567 → 58763 [PSH, ACK] Seq=71 Ack=698 Win=64640 Len=178 TSval=1705785348 TSecr=1641396817"
"92","0.186702","1698367969.313359000","10.45.0.3","192.168.238.198","GTP <TCP>","145","58763 → 34567 [PSH, ACK] Seq=698 Ack=249 Win=65152 Len=35 TSval=1641396818 TSecr=1705785348"
"93","0.186858","1698367969.313515000","192.168.238.198","10.45.0.3","GTP <TCP>","140","34567 → 58763 [PSH, ACK] Seq=249 Ack=733 Win=64640 Len=30 TSval=1705785348 TSecr=1641396818"
"94","0.187351","1698367969.314008000","10.45.0.3","192.168.238.198","GTP <TCP>","189","58763 → 34567 [PSH, ACK] Seq=733 Ack=279 Win=65152 Len=79 TSval=1641396818 TSecr=1705785348"
"95","0.187570","1698367969.314227000","192.168.238.198","10.45.0.3","GTP <TCP>","130","34567 → 58763 [PSH, ACK] Seq=279 Ack=812 Win=64640 Len=20 TSval=1705785349 TSecr=1641396818"
"96","0.187626","1698367969.314283000","192.168.238.198","10.45.0.3","GTP <TCP>","1458","34567 → 58763 [ACK] Seq=299 Ack=812 Win=64640 Len=1348 TSval=1705785349 TSecr=1641396818"
"97","0.187674","1698367969.314331000","192.168.238.198","10.45.0.3","GTP <TCP>","412","34567 → 58763 [PSH, ACK] Seq=1647 Ack=812 Win=64640 Len=302 TSval=1705785349 TSecr=1641396818"
"98","0.188158","1698367969.314815000","10.45.0.3","192.168.238.198","GTP <TCP>","110","58763 → 34567 [ACK] Seq=812 Ack=1949 Win=64256 Len=0 TSval=1641396819 TSecr=1705785349"
"99","0.188285","1698367969.314942000","10.45.0.3","192.168.238.198","GTP <TCP>","188","58763 → 34567 [PSH, ACK] Seq=812 Ack=1949 Win=64256 Len=78 TSval=1641396819 TSecr=1705785349"
"100","0.188640","1698367969.315297000","192.168.238.198","10.45.0.3","GTP <TCP>","130","34567 → 58763 [PSH, ACK] Seq=1949 Ack=890 Win=64640 Len=20 TSval=1705785350 TSecr=1641396819"
"101","0.188683","1698367969.315340000","192.168.238.198","10.45.0.3","GTP <TCP>","1458","34567 → 58763 [ACK] Seq=1969 Ack=890 Win=64640 Len=1348 TSval=1705785350 TSecr=1641396819"
"102","0.188724","1698367969.315381000","192.168.238.198","10.45.0.3","GTP <TCP>","298","34567 → 58763 [PSH, ACK] Seq=3317 Ack=890 Win=64640 Len=188 TSval=1705785350 TSecr=1641396819"
"103","0.189171","1698367969.315828000","10.45.0.3","192.168.238.198","GTP <TCP>","110","58763 → 34567 [ACK] Seq=890 Ack=3317 Win=63744 Len=0 TSval=1641396820 TSecr=1705785350"
"104","0.189350","1698367969.316007000","10.45.0.3","192.168.238.198","GTP <TCP>","189","58763 → 34567 [PSH, ACK] Seq=890 Ack=3505 Win=64256 Len=79 TSval=1641396820 TSecr=1705785350"
"105","0.189578","1698367969.316235000","192.168.238.198","10.45.0.3","GTP <TCP>","130","34567 → 58763 [PSH, ACK] Seq=3505 Ack=969 Win=64640 Len=20 TSval=1705785351 TSecr=1641396820"
"106","0.189625","1698367969.316282000","192.168.238.198","10.45.0.3","GTP <TCP>","1458","34567 → 58763 [ACK] Seq=3525 Ack=969 Win=64640 Len=1348 TSval=1705785351 TSecr=1641396820"
"107","0.189667","1698367969.316324000","192.168.238.198","10.45.0.3","GTP <TCP>","412","34567 → 58763 [PSH, ACK] Seq=4873 Ack=969 Win=64640 Len=302 TSval=1705785351 TSecr=1641396820"
"108","0.190069","1698367969.316726000","10.45.0.3","192.168.238.198","GTP <TCP>","110","58763 → 34567 [ACK] Seq=969 Ack=4873 Win=64256 Len=0 TSval=1641396821 TSecr=1705785351"
"109","0.190210","1698367969.316867000","10.45.0.3","192.168.238.198","GTP <TCP>","188","58763 → 34567 [PSH, ACK] Seq=969 Ack=5175 Win=64256 Len=78 TSval=1641396821 TSecr=1705785351"
"110","0.190489","1698367969.317146000","192.168.238.198","10.45.0.3","GTP <TCP>","130","34567 → 58763 [PSH, ACK] Seq=5175 Ack=1047 Win=64640 Len=20 TSval=1705785352 TSecr=1641396821"
"111","0.190534","1698367969.317191000","192.168.238.198","10.45.0.3","GTP <TCP>","1458","34567 → 58763 [ACK] Seq=5195 Ack=1047 Win=64640 Len=1348 TSval=1705785352 TSecr=1641396821"
"112","0.190577","1698367969.317234000","192.168.238.198","10.45.0.3","GTP <TCP>","298","34567 → 58763 [PSH, ACK] Seq=6543 Ack=1047 Win=64640 Len=188 TSval=1705785352 TSecr=1641396821"
"113","0.191023","1698367969.317680000","10.45.0.3","192.168.238.198","GTP <TCP>","110","58763 → 34567 [ACK] Seq=1047 Ack=6543 Win=64256 Len=0 TSval=1641396822 TSecr=1705785352"
"114","0.191163","1698367969.317820000","10.45.0.3","192.168.238.198","GTP <TCP>","189","58763 → 34567 [PSH, ACK] Seq=1047 Ack=6731 Win=64256 Len=79 TSval=1641396822 TSecr=1705785352"
"115","0.191394","1698367969.318051000","192.168.238.198","10.45.0.3","GTP <TCP>","130","34567 → 58763 [PSH, ACK] Seq=6731 Ack=1126 Win=64640 Len=20 TSval=1705785353 TSecr=1641396822"
"116","0.191438","1698367969.318095000","192.168.238.198","10.45.0.3","GTP <TCP>","1458","34567 → 58763 [ACK] Seq=6751 Ack=1126 Win=64640 Len=1348 TSval=1705785353 TSecr=1641396822"
"117","0.191483","1698367969.318140000","192.168.238.198","10.45.0.3","GTP <TCP>","412","34567 → 58763 [PSH, ACK] Seq=8099 Ack=1126 Win=64640 Len=302 TSval=1705785353 TSecr=1641396822"
"118","0.191885","1698367969.318542000","10.45.0.3","192.168.238.198","GTP <TCP>","110","58763 → 34567 [ACK] Seq=1126 Ack=8099 Win=64256 Len=0 TSval=1641396823 TSecr=1705785353"
"119","0.192016","1698367969.318673000","10.45.0.3","192.168.238.198","GTP <TCP>","188","58763 → 34567 [PSH, ACK] Seq=1126 Ack=8401 Win=64256 Len=78 TSval=1641396823 TSecr=1705785353"
"120","0.192250","1698367969.318907000","192.168.238.198","10.45.0.3","GTP <TCP>","130","34567 → 58763 [PSH, ACK] Seq=8401 Ack=1204 Win=64640 Len=20 TSval=1705785354 TSecr=1641396823"
"121","0.192292","1698367969.318949000","192.168.238.198","10.45.0.3","GTP <TCP>","1458","34567 → 58763 [ACK] Seq=8421 Ack=1204 Win=64640 Len=1348 TSval=1705785354 TSecr=1641396823"
"122","0.192337","1698367969.318994000","192.168.238.198","10.45.0.3","GTP <TCP>","298","34567 → 58763 [PSH, ACK] Seq=9769 Ack=1204 Win=64640 Len=188 TSval=1705785354 TSecr=1641396823"
"123","0.192739","1698367969.319396000","10.45.0.3","192.168.238.198","GTP <TCP>","110","58763 → 34567 [ACK] Seq=1204 Ack=9769 Win=64256 Len=0 TSval=1641396824 TSecr=1705785354"
"124","0.192943","1698367969.319600000","10.45.0.3","192.168.238.198","GTP <TCP>","189","58763 → 34567 [PSH, ACK] Seq=1204 Ack=9957 Win=64256 Len=79 TSval=1641396824 TSecr=1705785354"
"125","0.193228","1698367969.319885000","192.168.238.198","10.45.0.3","GTP <TCP>","130","34567 → 58763 [PSH, ACK] Seq=9957 Ack=1283 Win=64640 Len=20 TSval=1705785354 TSecr=1641396824"
"126","0.193277","1698367969.319934000","192.168.238.198","10.45.0.3","GTP <TCP>","1458","34567 → 58763 [ACK] Seq=9977 Ack=1283 Win=64640 Len=1348 TSval=1705785354 TSecr=1641396824"
"127","0.193319","1698367969.319976000","192.168.238.198","10.45.0.3","GTP <TCP>","412","34567 → 58763 [PSH, ACK] Seq=11325 Ack=1283 Win=64640 Len=302 TSval=1705785354 TSecr=1641396824"
"128","0.193747","1698367969.320404000","10.45.0.3","192.168.238.198","GTP <TCP>","110","58763 → 34567 [ACK] Seq=1283 Ack=11325 Win=63744 Len=0 TSval=1641396825 TSecr=1705785354"
"129","0.193855","1698367969.320512000","10.45.0.3","192.168.238.198","GTP <TCP>","188","58763 → 34567 [PSH, ACK] Seq=1283 Ack=11627 Win=64256 Len=78 TSval=1641396825 TSecr=1705785354"
"130","0.194049","1698367969.320706000","192.168.238.198","10.45.0.3","GTP <TCP>","130","34567 → 58763 [PSH, ACK] Seq=11627 Ack=1361 Win=64640 Len=20 TSval=1705785355 TSecr=1641396825"
"131","0.194091","1698367969.320748000","192.168.238.198","10.45.0.3","GTP <TCP>","1458","34567 → 58763 [ACK] Seq=11647 Ack=1361 Win=64640 Len=1348 TSval=1705785355 TSecr=1641396825"
"132","0.194135","1698367969.320792000","192.168.238.198","10.45.0.3","GTP <TCP>","298","34567 → 58763 [PSH, ACK] Seq=12995 Ack=1361 Win=64640 Len=188 TSval=1705785355 TSecr=1641396825"
"133","0.194590","1698367969.321247000","10.45.0.3","192.168.238.198","GTP <TCP>","110","58763 → 34567 [ACK] Seq=1361 Ack=12995 Win=64256 Len=0 TSval=1641396826 TSecr=1705785355"
"134","0.194715","1698367969.321372000","10.45.0.3","192.168.238.198","GTP <TCP>","189","58763 → 34567 [PSH, ACK] Seq=1361 Ack=13183 Win=64256 Len=79 TSval=1641396826 TSecr=1705785355"
"135","0.194913","1698367969.321570000","192.168.238.198","10.45.0.3","GTP <TCP>","130","34567 → 58763 [PSH, ACK] Seq=13183 Ack=1440 Win=64640 Len=20 TSval=1705785356 TSecr=1641396826"
"136","0.194960","1698367969.321617000","192.168.238.198","10.45.0.3","GTP <TCP>","1458","34567 → 58763 [ACK] Seq=13203 Ack=1440 Win=64640 Len=1348 TSval=1705785356 TSecr=1641396826"
"137","0.195001","1698367969.321658000","192.168.238.198","10.45.0.3","GTP <TCP>","412","34567 → 58763 [PSH, ACK] Seq=14551 Ack=1440 Win=64640 Len=302 TSval=1705785356 TSecr=1641396826"
"138","0.195446","1698367969.322103000","10.45.0.3","192.168.238.198","GTP <TCP>","110","58763 → 34567 [ACK] Seq=1440 Ack=14551 Win=64256 Len=0 TSval=1641396827 TSecr=1705785356"
"139","0.195619","1698367969.322276000","10.45.0.3","192.168.238.198","GTP <TCP>","188","58763 → 34567 [PSH, ACK] Seq=1440 Ack=14853 Win=64256 Len=78 TSval=1641396827 TSecr=1705785356"
"140","0.195879","1698367969.322536000","192.168.238.198","10.45.0.3","GTP <TCP>","130","34567 → 58763 [PSH, ACK] Seq=14853 Ack=1518 Win=64640 Len=20 TSval=1705785357 TSecr=1641396827"
"141","0.195926","1698367969.322583000","192.168.238.198","10.45.0.3","GTP <TCP>","1458","34567 → 58763 [ACK] Seq=14873 Ack=1518 Win=64640 Len=1348 TSval=1705785357 TSecr=1641396827"
"142","0.195967","1698367969.322624000","192.168.238.198","10.45.0.3","GTP <TCP>","298","34567 → 58763 [PSH, ACK] Seq=16221 Ack=1518 Win=64640 Len=188 TSval=1705785357 TSecr=1641396827"
"143","0.196379","1698367969.323036000","10.45.0.3","192.168.238.198","GTP <TCP>","110","58763 → 34567 [ACK] Seq=1518 Ack=16221 Win=64256 Len=0 TSval=1641396827 TSecr=1705785357"
"144","0.196515","1698367969.323172000","10.45.0.3","192.168.238.198","GTP <TCP>","189","58763 → 34567 [PSH, ACK] Seq=1518 Ack=16409 Win=64256 Len=79 TSval=1641396828 TSecr=1705785357"
"145","0.196717","1698367969.323374000","192.168.238.198","10.45.0.3","GTP <TCP>","130","34567 → 58763 [PSH, ACK] Seq=16409 Ack=1597 Win=64640 Len=20 TSval=1705785358 TSecr=1641396828"
"146","0.196758","1698367969.323415000","192.168.238.198","10.45.0.3","GTP <TCP>","1458","34567 → 58763 [ACK] Seq=16429 Ack=1597 Win=64640 Len=1348 TSval=1705785358 TSecr=1641396828"
"147","0.196811","1698367969.323468000","192.168.238.198","10.45.0.3","GTP <TCP>","412","34567 → 58763 [PSH, ACK] Seq=17777 Ack=1597 Win=64640 Len=302 TSval=1705785358 TSecr=1641396828"
"148","0.197195","1698367969.323852000","10.45.0.3","192.168.238.198","GTP <TCP>","110","58763 → 34567 [ACK] Seq=1597 Ack=17777 Win=64256 Len=0 TSval=1641396828 TSecr=1705785358"
"149","0.197385","1698367969.324042000","10.45.0.3","192.168.238.198","GTP <TCP>","188","58763 → 34567 [PSH, ACK] Seq=1597 Ack=18079 Win=64256 Len=78 TSval=1641396828 TSecr=1705785358"
"150","0.197588","1698367969.324245000","192.168.238.198","10.45.0.3","GTP <TCP>","130","34567 → 58763 [PSH, ACK] Seq=18079 Ack=1675 Win=64640 Len=20 TSval=1705785359 TSecr=1641396828"
"151","0.197635","1698367969.324292000","192.168.238.198","10.45.0.3","GTP <TCP>","1458","34567 → 58763 [ACK] Seq=18099 Ack=1675 Win=64640 Len=1348 TSval=1705785359 TSecr=1641396828"
"152","0.197677","1698367969.324334000","192.168.238.198","10.45.0.3","GTP <TCP>","298","34567 → 58763 [PSH, ACK] Seq=19447 Ack=1675 Win=64640 Len=188 TSval=1705785359 TSecr=1641396828"
"153","0.198089","1698367969.324746000","10.45.0.3","192.168.238.198","GTP <TCP>","110","58763 → 34567 [ACK] Seq=1675 Ack=19447 Win=64256 Len=0 TSval=1641396829 TSecr=1705785359"
"154","0.198216","1698367969.324873000","10.45.0.3","192.168.238.198","GTP <TCP>","189","58763 → 34567 [PSH, ACK] Seq=1675 Ack=19635 Win=64256 Len=79 TSval=1641396829 TSecr=1705785359"
"155","0.198463","1698367969.325120000","192.168.238.198","10.45.0.3","GTP <TCP>","130","34567 → 58763 [PSH, ACK] Seq=19635 Ack=1754 Win=64640 Len=20 TSval=1705785360 TSecr=1641396829"
"156","0.198505","1698367969.325162000","192.168.238.198","10.45.0.3","GTP <TCP>","1458","34567 → 58763 [ACK] Seq=19655 Ack=1754 Win=64640 Len=1348 TSval=1705785360 TSecr=1641396829"
"157","0.198553","1698367969.325210000","192.168.238.198","10.45.0.3","GTP <TCP>","412","34567 → 58763 [PSH, ACK] Seq=21003 Ack=1754 Win=64640 Len=302 TSval=1705785360 TSecr=1641396829"
"158","0.198937","1698367969.325594000","10.45.0.3","192.168.238.198","GTP <TCP>","110","58763 → 34567 [ACK] Seq=1754 Ack=21003 Win=64256 Len=0 TSval=1641396830 TSecr=1705785360"
"159","0.199048","1698367969.325705000","10.45.0.3","192.168.238.198","GTP <TCP>","188","58763 → 34567 [PSH, ACK] Seq=1754 Ack=21305 Win=64256 Len=78 TSval=1641396830 TSecr=1705785360"
"160","0.199269","1698367969.325926000","192.168.238.198","10.45.0.3","GTP <TCP>","130","34567 → 58763 [PSH, ACK] Seq=21305 Ack=1832 Win=64640 Len=20 TSval=1705785361 TSecr=1641396830"
"161","0.199317","1698367969.325974000","192.168.238.198","10.45.0.3","GTP <TCP>","1458","34567 → 58763 [ACK] Seq=21325 Ack=1832 Win=64640 Len=1348 TSval=1705785361 TSecr=1641396830"
"162","0.199361","1698367969.326018000","192.168.238.198","10.45.0.3","GTP <TCP>","298","34567 → 58763 [PSH, ACK] Seq=22673 Ack=1832 Win=64640 Len=188 TSval=1705785361 TSecr=1641396830"
"163","0.199772","1698367969.326429000","10.45.0.3","192.168.238.198","GTP <TCP>","110","58763 → 34567 [ACK] Seq=1832 Ack=22673 Win=64256 Len=0 TSval=1641396831 TSecr=1705785361"
"164","0.199931","1698367969.326588000","10.45.0.3","192.168.238.198","GTP <TCP>","189","58763 → 34567 [PSH, ACK] Seq=1832 Ack=22861 Win=64256 Len=79 TSval=1641396831 TSecr=1705785361"
"165","0.200121","1698367969.326778000","192.168.238.198","10.45.0.3","GTP <TCP>","130","34567 → 58763 [PSH, ACK] Seq=22861 Ack=1911 Win=64640 Len=20 TSval=1705785361 TSecr=1641396831"
"166","0.200162","1698367969.326819000","192.168.238.198","10.45.0.3","GTP <TCP>","1458","34567 → 58763 [ACK] Seq=22881 Ack=1911 Win=64640 Len=1348 TSval=1705785361 TSecr=1641396831"
"167","0.200204","1698367969.326861000","192.168.238.198","10.45.0.3","GTP <TCP>","412","34567 → 58763 [PSH, ACK] Seq=24229 Ack=1911 Win=64640 Len=302 TSval=1705785361 TSecr=1641396831"
"168","0.200641","1698367969.327298000","10.45.0.3","192.168.238.198","GTP <TCP>","110","58763 → 34567 [ACK] Seq=1911 Ack=24531 Win=63744 Len=0 TSval=1641396832 TSecr=1705785361"
"169","0.200812","1698367969.327469000","10.45.0.3","192.168.238.198","GTP <TCP>","188","58763 → 34567 [PSH, ACK] Seq=1911 Ack=24531 Win=64256 Len=78 TSval=1641396832 TSecr=1705785361"
"170","0.201001","1698367969.327658000","192.168.238.198","10.45.0.3","GTP <TCP>","130","34567 → 58763 [PSH, ACK] Seq=24531 Ack=1989 Win=64640 Len=20 TSval=1705785362 TSecr=1641396832"
"171","0.201044","1698367969.327701000","192.168.238.198","10.45.0.3","GTP <TCP>","1458","34567 → 58763 [ACK] Seq=24551 Ack=1989 Win=64640 Len=1348 TSval=1705785362 TSecr=1641396832"
"172","0.201084","1698367969.327741000","192.168.238.198","10.45.0.3","GTP <TCP>","298","34567 → 58763 [PSH, ACK] Seq=25899 Ack=1989 Win=64640 Len=188 TSval=1705785362 TSecr=1641396832"
"173","0.201580","1698367969.328237000","10.45.0.3","192.168.238.198","GTP <TCP>","110","58763 → 34567 [ACK] Seq=1989 Ack=25899 Win=63744 Len=0 TSval=1641396833 TSecr=1705785362"
"174","0.201699","1698367969.328356000","10.45.0.3","192.168.238.198","GTP <TCP>","189","58763 → 34567 [PSH, ACK] Seq=1989 Ack=26087 Win=64256 Len=79 TSval=1641396833 TSecr=1705785362"
"175","0.201950","1698367969.328607000","192.168.238.198","10.45.0.3","GTP <TCP>","130","34567 → 58763 [PSH, ACK] Seq=26087 Ack=2068 Win=64640 Len=20 TSval=1705785363 TSecr=1641396833"
"176","0.201996","1698367969.328653000","192.168.238.198","10.45.0.3","GTP <TCP>","1458","34567 → 58763 [ACK] Seq=26107 Ack=2068 Win=64640 Len=1348 TSval=1705785363 TSecr=1641396833"
"177","0.202039","1698367969.328696000","192.168.238.198","10.45.0.3","GTP <TCP>","412","34567 → 58763 [PSH, ACK] Seq=27455 Ack=2068 Win=64640 Len=302 TSval=1705785363 TSecr=1641396833"
"178","0.202411","1698367969.329068000","10.45.0.3","192.168.238.198","GTP <TCP>","110","58763 → 34567 [ACK] Seq=2068 Ack=27455 Win=64256 Len=0 TSval=1641396834 TSecr=1705785363"
"179","0.202557","1698367969.329214000","10.45.0.3","192.168.238.198","GTP <TCP>","188","58763 → 34567 [PSH, ACK] Seq=2068 Ack=27757 Win=64256 Len=78 TSval=1641396834 TSecr=1705785363"
"180","0.202796","1698367969.329453000","192.168.238.198","10.45.0.3","GTP <TCP>","130","34567 → 58763 [PSH, ACK] Seq=27757 Ack=2146 Win=64640 Len=20 TSval=1705785364 TSecr=1641396834"
"181","0.202839","1698367969.329496000","192.168.238.198","10.45.0.3","GTP <TCP>","1458","34567 → 58763 [ACK] Seq=27777 Ack=2146 Win=64640 Len=1348 TSval=1705785364 TSecr=1641396834"
"182","0.202879","1698367969.329536000","192.168.238.198","10.45.0.3","GTP <TCP>","298","34567 → 58763 [PSH, ACK] Seq=29125 Ack=2146 Win=64640 Len=188 TSval=1705785364 TSecr=1641396834"
"183","0.203390","1698367969.330047000","10.45.0.3","192.168.238.198","GTP <TCP>","110","58763 → 34567 [ACK] Seq=2146 Ack=29313 Win=64256 Len=0 TSval=1641396834 TSecr=1705785364"
"184","0.203562","1698367969.330219000","10.45.0.3","192.168.238.198","GTP <TCP>","189","58763 → 34567 [PSH, ACK] Seq=2146 Ack=29313 Win=64256 Len=79 TSval=1641396835 TSecr=1705785364"
"185","0.203773","1698367969.330430000","192.168.238.198","10.45.0.3","GTP <TCP>","130","34567 → 58763 [PSH, ACK] Seq=29313 Ack=2225 Win=64640 Len=20 TSval=1705785365 TSecr=1641396835"
"186","0.203821","1698367969.330478000","192.168.238.198","10.45.0.3","GTP <TCP>","1458","34567 → 58763 [ACK] Seq=29333 Ack=2225 Win=64640 Len=1348 TSval=1705785365 TSecr=1641396835"
"187","0.203867","1698367969.330524000","192.168.238.198","10.45.0.3","GTP <TCP>","412","34567 → 58763 [PSH, ACK] Seq=30681 Ack=2225 Win=64640 Len=302 TSval=1705785365 TSecr=1641396835"
"188","0.204294","1698367969.330951000","10.45.0.3","192.168.238.198","GTP <TCP>","110","58763 → 34567 [ACK] Seq=2225 Ack=30681 Win=64256 Len=0 TSval=1641396835 TSecr=1705785365"
"189","0.204433","1698367969.331090000","10.45.0.3","192.168.238.198","GTP <TCP>","188","58763 → 34567 [PSH, ACK] Seq=2225 Ack=30983 Win=64256 Len=78 TSval=1641396836 TSecr=1705785365"
"190","0.204662","1698367969.331319000","192.168.238.198","10.45.0.3","GTP <TCP>","130","34567 → 58763 [PSH, ACK] Seq=30983 Ack=2303 Win=64640 Len=20 TSval=1705785366 TSecr=1641396836"
"191","0.204704","1698367969.331361000","192.168.238.198","10.45.0.3","GTP <TCP>","1458","34567 → 58763 [ACK] Seq=31003 Ack=2303 Win=64640 Len=1348 TSval=1705785366 TSecr=1641396836"
"192","0.204747","1698367969.331404000","192.168.238.198","10.45.0.3","GTP <TCP>","298","34567 → 58763 [PSH, ACK] Seq=32351 Ack=2303 Win=64640 Len=188 TSval=1705785366 TSecr=1641396836"
"193","0.205167","1698367969.331824000","10.45.0.3","192.168.238.198","GTP <TCP>","110","58763 → 34567 [ACK] Seq=2303 Ack=32539 Win=64256 Len=0 TSval=1641396836 TSecr=1705785366"
"194","0.205312","1698367969.331969000","10.45.0.3","192.168.238.198","GTP <TCP>","189","58763 → 34567 [PSH, ACK] Seq=2303 Ack=32539 Win=64256 Len=79 TSval=1641396836 TSecr=1705785366"
"195","0.205514","1698367969.332171000","192.168.238.198","10.45.0.3","GTP <TCP>","130","34567 → 58763 [PSH, ACK] Seq=32539 Ack=2382 Win=64640 Len=20 TSval=1705785367 TSecr=1641396836"
"196","0.205557","1698367969.332214000","192.168.238.198","10.45.0.3","GTP <TCP>","1458","34567 → 58763 [ACK] Seq=32559 Ack=2382 Win=64640 Len=1348 TSval=1705785367 TSecr=1641396836"
"197","0.205603","1698367969.332260000","192.168.238.198","10.45.0.3","GTP <TCP>","412","34567 → 58763 [PSH, ACK] Seq=33907 Ack=2382 Win=64640 Len=302 TSval=1705785367 TSecr=1641396836"
"198","0.206033","1698367969.332690000","10.45.0.3","192.168.238.198","GTP <TCP>","110","58763 → 34567 [ACK] Seq=2382 Ack=33907 Win=63744 Len=0 TSval=1641396837 TSecr=1705785367"
"199","0.206184","1698367969.332841000","10.45.0.3","192.168.238.198","GTP <TCP>","188","58763 → 34567 [PSH, ACK] Seq=2382 Ack=34209 Win=64256 Len=78 TSval=1641396837 TSecr=1705785367"
"200","0.206378","1698367969.333035000","192.168.238.198","10.45.0.3","GTP <TCP>","130","34567 → 58763 [PSH, ACK] Seq=34209 Ack=2460 Win=64640 Len=20 TSval=1705785368 TSecr=1641396837"
"201","0.206417","1698367969.333074000","192.168.238.198","10.45.0.3","GTP <TCP>","1458","34567 → 58763 [ACK] Seq=34229 Ack=2460 Win=64640 Len=1348 TSval=1705785368 TSecr=1641396837"
"202","0.206459","1698367969.333116000","192.168.238.198","10.45.0.3","GTP <TCP>","298","34567 → 58763 [PSH, ACK] Seq=35577 Ack=2460 Win=64640 Len=188 TSval=1705785368 TSecr=1641396837"
"203","0.206853","1698367969.333510000","10.45.0.3","192.168.238.198","GTP <TCP>","110","58763 → 34567 [ACK] Seq=2460 Ack=35577 Win=64256 Len=0 TSval=1641396838 TSecr=1705785368"
"204","0.207054","1698367969.333711000","10.45.0.3","192.168.238.198","GTP <TCP>","189","58763 → 34567 [PSH, ACK] Seq=2460 Ack=35765 Win=64256 Len=79 TSval=1641396838 TSecr=1705785368"
"205","0.207283","1698367969.333940000","192.168.238.198","10.45.0.3","GTP <TCP>","130","34567 → 58763 [PSH, ACK] Seq=35765 Ack=2539 Win=64640 Len=20 TSval=1705785369 TSecr=1641396838"
"206","0.207329","1698367969.333986000","192.168.238.198","10.45.0.3","GTP <TCP>","1458","34567 → 58763 [ACK] Seq=35785 Ack=2539 Win=64640 Len=1348 TSval=1705785369 TSecr=1641396838"
"207","0.207373","1698367969.334030000","192.168.238.198","10.45.0.3","GTP <TCP>","412","34567 → 58763 [PSH, ACK] Seq=37133 Ack=2539 Win=64640 Len=302 TSval=1705785369 TSecr=1641396838"
"208","0.207791","1698367969.334448000","10.45.0.3","192.168.238.198","GTP <TCP>","110","58763 → 34567 [ACK] Seq=2539 Ack=37133 Win=64256 Len=0 TSval=1641396839 TSecr=1705785369"
"209","0.207909","1698367969.334566000","10.45.0.3","192.168.238.198","GTP <TCP>","188","58763 → 34567 [PSH, ACK] Seq=2539 Ack=37435 Win=64256 Len=78 TSval=1641396839 TSecr=1705785369"
"210","0.208141","1698367969.334798000","192.168.238.198","10.45.0.3","GTP <TCP>","130","34567 → 58763 [PSH, ACK] Seq=37435 Ack=2617 Win=64640 Len=20 TSval=1705785369 TSecr=1641396839"
"211","0.208182","1698367969.334839000","192.168.238.198","10.45.0.3","GTP <TCP>","1458","34567 → 58763 [ACK] Seq=37455 Ack=2617 Win=64640 Len=1348 TSval=1705785369 TSecr=1641396839"
"212","0.208230","1698367969.334887000","192.168.238.198","10.45.0.3","GTP <TCP>","298","34567 → 58763 [PSH, ACK] Seq=38803 Ack=2617 Win=64640 Len=188 TSval=1705785369 TSecr=1641396839"
"213","0.208667","1698367969.335324000","10.45.0.3","192.168.238.198","GTP <TCP>","110","58763 → 34567 [ACK] Seq=2617 Ack=38803 Win=64256 Len=0 TSval=1641396840 TSecr=1705785369"
"214","0.208839","1698367969.335496000","10.45.0.3","192.168.238.198","GTP <TCP>","189","58763 → 34567 [PSH, ACK] Seq=2617 Ack=38991 Win=64256 Len=79 TSval=1641396840 TSecr=1705785369"
"215","0.209089","1698367969.335746000","192.168.238.198","10.45.0.3","GTP <TCP>","130","34567 → 58763 [PSH, ACK] Seq=38991 Ack=2696 Win=64640 Len=20 TSval=1705785370 TSecr=1641396840"
"216","0.209132","1698367969.335789000","192.168.238.198","10.45.0.3","GTP <TCP>","1458","34567 → 58763 [ACK] Seq=39011 Ack=2696 Win=64640 Len=1348 TSval=1705785370 TSecr=1641396840"
"217","0.209175","1698367969.335832000","192.168.238.198","10.45.0.3","GTP <TCP>","412","34567 → 58763 [PSH, ACK] Seq=40359 Ack=2696 Win=64640 Len=302 TSval=1705785370 TSecr=1641396840"
"218","0.209565","1698367969.336222000","10.45.0.3","192.168.238.198","GTP <TCP>","110","58763 → 34567 [ACK] Seq=2696 Ack=40359 Win=64256 Len=0 TSval=1641396841 TSecr=1705785370"
"219","0.209778","1698367969.336435000","10.45.0.3","192.168.238.198","GTP <TCP>","188","58763 → 34567 [PSH, ACK] Seq=2696 Ack=40661 Win=64256 Len=78 TSval=1641396841 TSecr=1705785370"
"220","0.209964","1698367969.336621000","192.168.238.198","10.45.0.3","GTP <TCP>","130","34567 → 58763 [PSH, ACK] Seq=40661 Ack=2774 Win=64640 Len=20 TSval=1705785371 TSecr=1641396841"
